"id","title","link","pubDate","desc"
"HIN258","nhrc notice to telangana over five year olds death","http://www.thehindu.com/news/cities/Delhi/NHRC-notice-to-Telangana-over-five-year-old%E2%80%99s-death/article16956498.ece?utm_source=RSS_Feed&utm_medium=RSS&utm_campaign=RSS_Syndication","Thu, 29 Dec 2016 01:33:58 +0530","terming it a tragic incident the national human rights commission nhrc on wednesday issued notice to authorities in telangana following reports of a child dying after falling into a vat at a gove"
"HIN259","ndmc initiative seeks to make lutyens delhi open urination free","http://www.thehindu.com/news/cities/Delhi/NDMC-initiative-seeks-to-make-Lutyens%E2%80%99-Delhi-open-urination-free/article16956493.ece?utm_source=RSS_Feed&utm_medium=RSS&utm_campaign=RSS_Syndication","Thu, 29 Dec 2016 01:31:44 +0530","the new delhi municipal council ndmc has launched an initiative to prevent people from urinating in the open in lutyens delhi with both infrastructure improvements and punitive action being taken"
"HIN260","going the rhino way","http://www.thehindu.com/opinion/letters/article16956492.ece?utm_source=RSS_Feed&utm_medium=RSS&utm_campaign=RSS_Syndication","Thu, 29 Dec 2016 01:31:39 +0530","the proposal being put forth by the kerala government for suitable amendments to the wildlife protection act to use deer antlers for medicinal purposes is fraught with danger antlers could end up i"
"HIN261","demonetisation a reckless move","http://www.thehindu.com/news/cities/Delhi/%E2%80%98Demonetisation-a-reckless-move%E2%80%99/article16956491.ece?utm_source=RSS_Feed&utm_medium=RSS&utm_campaign=RSS_Syndication","Thu, 29 Dec 2016 01:31:17 +0530","the right to food campaign slams decision as attack on right to life"
"HIN262","pakistans cpec offer","http://www.thehindu.com/opinion/letters/Pakistan%E2%80%99s-CPEC-offer/article16956487.ece?utm_source=RSS_Feed&utm_medium=RSS&utm_campaign=RSS_Syndication","Thu, 29 Dec 2016 01:31:07 +0530","just as china is sensitive about the one china policy so too is india regarding one kashmir china is aware that the cpec passes thorough the disputed territory of kashmir editorial dec 28 it"
"HIN263","aap fields delhi mla against badal","http://www.thehindu.com/news/cities/Delhi/AAP-fields-Delhi-MLA-against-Badal/article16956489.ece?utm_source=RSS_Feed&utm_medium=RSS&utm_campaign=RSS_Syndication","Thu, 29 Dec 2016 01:30:13 +0530","jarnail singh legislator from rajouri garden had allegedly hurled a shoe at chidambaram in 2009"
"HIN264","bureaucrats ire","http://www.thehindu.com/opinion/letters/Bureaucrat%E2%80%99s-ire/article16956486.ece?utm_source=RSS_Feed&utm_medium=RSS&utm_campaign=RSS_Syndication","Thu, 29 Dec 2016 01:29:07 +0530","i am shocked by the former tamil nadu chief secretarys claims and his lashing out at the central and state governments calling the recent income tax raid on his house and official chamber in the ta"
"HIN265","dairy and food mela 2016 begins at svvu","http://www.thehindu.com/news/national/andhra-pradesh/%E2%80%98Dairy-and-Food-Mela-2016%E2%80%99-begins-at-SVVU/article16956481.ece?utm_source=RSS_Feed&utm_medium=RSS&utm_campaign=RSS_Syndication","Thu, 29 Dec 2016 01:28:29 +0530","sri venkateswara veterinary universitys svvu college of dairy technology launched a two day dairy and food mela 2016 in the varsity premises here on wednesday svvu vice chancellor and special"
"HIN266","politics over demonetisation","http://www.thehindu.com/opinion/letters/article16956465.ece?utm_source=RSS_Feed&utm_medium=RSS&utm_campaign=RSS_Syndication","Thu, 29 Dec 2016 01:28:19 +0530","it is strange that west bengal chief minister mamata banerjees charges levelled against the prime minister were given importance while the prime ministers speech on the fight against black money and"
"HIN267","bind over cases will be slapped on cockfight organisers sp","http://www.thehindu.com/news/national/andhra-pradesh/Bind-over-cases-will-be-slapped-on-cockfight-organisers-SP/article16956467.ece?utm_source=RSS_Feed&utm_medium=RSS&utm_campaign=RSS_Syndication","Thu, 29 Dec 2016 01:28:13 +0530","kakinada with the andhra pradesh high court issuing a directive against organising cockfights the police in east and west godavari districts are focusing on taking the organisers into custody couns"
"HIN268","fir against ram gopal varma","http://www.thehindu.com/news/national/andhra-pradesh/FIR-against-Ram-Gopal-Varma/article16956460.ece?utm_source=RSS_Feed&utm_medium=RSS&utm_campaign=RSS_Syndication","Thu, 29 Dec 2016 01:26:16 +0530","director ram gopal varma has been booked by the nunna police for allegedly making intentional insults with an intent to provoke breach of peace and making statements that promote enmity here on wedne"
"HIN269","tech transfer to industries from isro a continuous process","http://www.thehindu.com/news/national/andhra-pradesh/%E2%80%98Tech-transfer-to-industries-from-ISRO-a-continuous-process%E2%80%99/article16956457.ece?utm_source=RSS_Feed&utm_medium=RSS&utm_campaign=RSS_Syndication","Thu, 29 Dec 2016 01:26:15 +0530","satish dhawan space centre sdsc sriharikota director p kunhikrishnan on wednesday said technology transfer to the indian industries by the indian space research organisation isro would be a c"
"HIN270","sunderlal patwa former m p chief minister no more","http://www.thehindu.com/news/national/other-states/Sunderlal-Patwa-former-M.P.-Chief-Minister-no-more/article16956448.ece?utm_source=RSS_Feed&utm_medium=RSS&utm_campaign=RSS_Syndication","Thu, 29 Dec 2016 01:25:36 +0530","veteran bjp leader and two time madhya pradesh chief minister sunderlal patwa passed away here on wednesday after a brief illness the 92 year old a former union minister suffered a heart attack in"
"HIN271","maoist movement suffered a body blow","http://www.thehindu.com/news/national/andhra-pradesh/Maoist-movement-suffered-a-body-blow/article16956442.ece?utm_source=RSS_Feed&utm_medium=RSS&utm_campaign=RSS_Syndication","Thu, 29 Dec 2016 01:25:11 +0530","naxals losing ground as police gained upper hand after the ramgarh encounter"
"HIN272","she pedals to promote swachh bharat","http://www.thehindu.com/news/national/andhra-pradesh/She-pedals-to-promote-Swachh-Bharat/article16956436.ece?utm_source=RSS_Feed&utm_medium=RSS&utm_campaign=RSS_Syndication","Thu, 29 Dec 2016 01:25:04 +0530","i vijayalakshmi 52 is an embodiment of courage and confidence for she trained hard for a gruelling 26 day cycle expedition from ichchapuram to tada aimed at promoting the swachh bharat initiative"
"HIN273","book festival to showcase govt initiatives too","http://www.thehindu.com/news/national/andhra-pradesh/Book-festival-to-showcase-govt.-initiatives-too/article16956432.ece?utm_source=RSS_Feed&utm_medium=RSS&utm_campaign=RSS_Syndication","Thu, 29 Dec 2016 01:24:25 +0530","vijayawada the 28th vijayawada book festival will also showcase various government initiatives and programmes the platform serving as a real festival for book lovers since decades will also be a pla"
"HIN274","music college alumni to hold concert on jan 11","http://www.thehindu.com/news/national/andhra-pradesh/Music-college-alumni-to-hold-concert-on-Jan.-11/article16956429.ece?utm_source=RSS_Feed&utm_medium=RSS&utm_campaign=RSS_Syndication","Thu, 29 Dec 2016 01:24:10 +0530","old students association of maharajahs government music and dance college that is completing 97 years of its existence is organising a concert at the college here on january 11 2017 felicitation"
"HIN275","mori is first village to get piped gas supply in ap","http://www.thehindu.com/news/national/andhra-pradesh/Mori-is-first-village-to-get-piped-gas-supply-in-AP/article16956424.ece?utm_source=RSS_Feed&utm_medium=RSS&utm_campaign=RSS_Syndication","Thu, 29 Dec 2016 01:23:21 +0530","state to sign mou with ap gas development corporation"
"HIN276","dacoits loot 42 kg gold from muthoot finance branch","http://www.thehindu.com/news/cities/Hyderabad/Dacoits-loot-42-kg-gold-from-Muthoot-Finance-branch/article16956422.ece?utm_source=RSS_Feed&utm_medium=RSS&utm_campaign=RSS_Syndication","Thu, 29 Dec 2016 01:23:11 +0530","posing as cbi officers gang of five commits daring robbery at ramachandrapuram"
"HIN277","pick your choice at handloom expo","http://www.thehindu.com/news/cities/Visakhapatnam/Pick-your-choice-at-handloom-expo/article16956411.ece?utm_source=RSS_Feed&utm_medium=RSS&utm_campaign=RSS_Syndication","Thu, 29 Dec 2016 01:22:52 +0530","kora cotton saris from coimbatore organic cotton saris from salem and manamedu and tie and dye saris from chinnalapatti have been put up on display at the week long sankranti handloom exhibition cu"
"HIN278","science congress complete works before deadline officials told","http://www.thehindu.com/news/national/andhra-pradesh/Science-Congress-Complete-works-before-deadline-officials-told/article16956403.ece?utm_source=RSS_Feed&utm_medium=RSS&utm_campaign=RSS_Syndication","Thu, 29 Dec 2016 01:22:46 +0530","minister inspects works at sri venkateswara university campus"
"HIN279","man held within minutes of car theft in north delhi","http://www.thehindu.com/news/cities/Delhi/Man-held-within-minutes-of-car-theft-in-north-Delhi/article16956399.ece?utm_source=RSS_Feed&utm_medium=RSS&utm_campaign=RSS_Syndication","Thu, 29 Dec 2016 01:22:11 +0530","after allegedly lifting several vehicles in the capital luck finally ran out for a gang on tuesday as a car stolen by them recently was recovered within 45 minutes of the crime while four persons w"
"HIN280","government to train more teachers","http://www.thehindu.com/news/cities/Delhi/Government-to-train-more-teachers/article16956395.ece?utm_source=RSS_Feed&utm_medium=RSS&utm_campaign=RSS_Syndication","Thu, 29 Dec 2016 01:22:02 +0530","it will double faculty positions at its teacher training bodies from around 240 currently to 600"
"HIN281","nilgai injured in accident rescued","http://www.thehindu.com/news/cities/Delhi/Nilgai-injured-in-accident-rescued/article16956392.ece?utm_source=RSS_Feed&utm_medium=RSS&utm_campaign=RSS_Syndication","Thu, 29 Dec 2016 01:21:53 +0530","an adult male nilgai was rescued by wildlife sos after it was grievously injured in an accident at narela on wednesday the antelope is currently under observation and treatment the nilgai had slipp"
"HIN282","leopard strays into mewat village caught","http://www.thehindu.com/news/cities/Delhi/Leopard-strays-into-Mewat-village-caught/article16956389.ece?utm_source=RSS_Feed&utm_medium=RSS&utm_campaign=RSS_Syndication","Thu, 29 Dec 2016 01:21:32 +0530","incident comes a month after a feline was killed in sohna"
"HIN283","six held over fake education loans","http://www.thehindu.com/news/cities/Delhi/Six-held-over-fake-education-loans/article16956385.ece?utm_source=RSS_Feed&utm_medium=RSS&utm_campaign=RSS_Syndication","Thu, 29 Dec 2016 01:21:21 +0530","as many as 700 people duped of over rs 2 crore gang used names of established companies"
"HIN284","protesting villagers block a p highway","http://www.thehindu.com/news/national/andhra-pradesh/Protesting-villagers-block-A.P.-highway/article16956380.ece?utm_source=RSS_Feed&utm_medium=RSS&utm_campaign=RSS_Syndication","Thu, 29 Dec 2016 01:21:10 +0530","facing a threat of submersion due to the rising backwaters of the gandikota project hundreds of people from submersible villages continued the blockade on the renigunta tadpatri national highway at"
"HIN285","baking her way to success","http://www.thehindu.com/news/cities/Visakhapatnam/Baking-her-way-to-success/article16956369.ece?utm_source=RSS_Feed&utm_medium=RSS&utm_campaign=RSS_Syndication","Thu, 29 Dec 2016 01:20:36 +0530","as soon as her seven month old son slips into a deep slumber meghana bhadauria heads to the kitchen to wield a cream filled piping bag to give the finishing touches to a pineapple cake that is gettin"
"HIN286","warner gives australia a shot at forcing a result","http://www.thehindu.com/sport/Warner-gives-Australia-a-shot-at-forcing-a-result/article16956366.ece?utm_source=RSS_Feed&utm_medium=RSS&utm_campaign=RSS_Syndication","Thu, 29 Dec 2016 01:20:30 +0530","a run a ball hundred from david warner gave australia an outside chance of forcing a result after azhar ali posted a double century for pakistan in the second test here on wednesday warner smashed 14"
"HIN287","2 held for conducting sex determination test","http://www.thehindu.com/news/cities/Delhi/2-held-for-conducting-sex-determination-test/article16956363.ece?utm_source=RSS_Feed&utm_medium=RSS&utm_campaign=RSS_Syndication","Thu, 29 Dec 2016 01:20:26 +0530","two persons have been arrested by a gurugram administration team for allegedly conducting sex determination test at aligarh in uttar pradesh an fir has been registered at sohna here in this connecti"
"HIN288","performers artists add variety to flamingo bird festival","http://www.thehindu.com/news/national/andhra-pradesh/Performers-artists-add-variety-to-flamingo-bird-festival/article16956356.ece?utm_source=RSS_Feed&utm_medium=RSS&utm_campaign=RSS_Syndication","Thu, 29 Dec 2016 01:20:11 +0530","apart from the display stalls put up by the government departments performers and artists made significant contributions to attract more visitors to the flamingo bird festival being held at sullurup"
"HIN289","newspaper photograph helps nab cheat","http://www.thehindu.com/news/cities/Delhi/Newspaper-photograph-helps-nab-cheat/article16956354.ece?utm_source=RSS_Feed&utm_medium=RSS&utm_campaign=RSS_Syndication","Thu, 29 Dec 2016 01:20:08 +0530","a photograph in a newspaper has helped trace a man who allegedly cheated many people by promising to help them get their e rickshaws financed the police said on wednesday cash not recoveredthe accus"
"HIN290","arjuna awardee questioned in rape case","http://www.thehindu.com/news/cities/Delhi/Arjuna-awardee-questioned-in-rape-case/article16956347.ece?utm_source=RSS_Feed&utm_medium=RSS&utm_campaign=RSS_Syndication","Thu, 29 Dec 2016 01:19:43 +0530","an arjuna awardee shooter accused of raping a fellow sportsperson was on wednesday questioned by the police after he joined the investigation at the chanakyapuri police station here the accused has b"
"HIN291","wifes suicide kabaddi player father get bail","http://www.thehindu.com/news/cities/Delhi/Wife%E2%80%99s-suicide-kabaddi-player-father-get-bail/article16956344.ece?utm_source=RSS_Feed&utm_medium=RSS&utm_campaign=RSS_Syndication","Thu, 29 Dec 2016 01:19:26 +0530","national kabaddi player rohit kumar who was arrested in connection with the alleged suicide of his wife lalita was on wednesday granted bail by a delhi court the court also granted relief to his fa"
"HIN292","cbi officers asked to pay damages to dd official","http://www.thehindu.com/news/national/karnataka/CBI-officers-asked-to-pay-damages-to-DD-official/article16956342.ece?utm_source=RSS_Feed&utm_medium=RSS&utm_campaign=RSS_Syndication","Thu, 29 Dec 2016 01:19:23 +0530","a city court has ordered that two officers of the central bureau of investigation are personally liable to pay damages of rs 2 5 lakh to mahesh joshi additional director general of doordarshan sout"
"HIN293","ioas action leads to political sniping","http://www.thehindu.com/sport/IOA%E2%80%99s-action-leads-to-political-sniping/article16956340.ece?utm_source=RSS_Feed&utm_medium=RSS&utm_campaign=RSS_Syndication","Thu, 29 Dec 2016 01:19:11 +0530","things are never dull in indian sports more than any on field exploit by the athletes it is the shenanigans of those running the various sporting bodies that fuel controversy ever so often the late"
"HIN294","president offers prayers at tirumala","http://www.thehindu.com/news/national/andhra-pradesh/President-offers-prayers-at-Tirumala/article16956330.ece?utm_source=RSS_Feed&utm_medium=RSS&utm_campaign=RSS_Syndication","Thu, 29 Dec 2016 01:18:35 +0530","tirumala president pranab mukherjee on wednesday offered prayers at the hill temple of lord venkateswara he was accompanied by his daughter sharmistha mukherjee and other family members besides gov"
"HIN295","assaulted maids employer 2 others held","http://www.thehindu.com/news/cities/Delhi/Assaulted-maid%E2%80%99s-employer-2-others-held/article16956326.ece?utm_source=RSS_Feed&utm_medium=RSS&utm_campaign=RSS_Syndication","Thu, 29 Dec 2016 01:18:11 +0530","five days after a case was registered in connection with the alleged assault of a 24 year old domestic help the delhi police on wednesday claimed to have arrested her employer and two people associa"
"HIN296","pcb to provide budgetary support to stps","http://www.thehindu.com/news/cities/Visakhapatnam/PCB-to-provide-budgetary-support-to-STPs/article16956324.ece?utm_source=RSS_Feed&utm_medium=RSS&utm_campaign=RSS_Syndication","Thu, 29 Dec 2016 01:18:06 +0530","workshop on new waste management rules begins"
"HIN297","sabarimala temple to open tomorrow for makaravilakku","http://www.thehindu.com/news/national/kerala/Sabarimala-temple-to-open-tomorrow-for-Makaravilakku/article16956319.ece?utm_source=RSS_Feed&utm_medium=RSS&utm_campaign=RSS_Syndication","Thu, 29 Dec 2016 01:18:04 +0530","the lord ayyappa temple at sabarimala will be opened for the makaravilakku festival on friday afternoon hundreds of devotees from different parts of telangana andhra pradesh karnataka and tamil nad"
"HIN298","protesting villagers block the highway","http://www.thehindu.com/news/national/andhra-pradesh/Protesting-villagers-block-the-highway/article16956316.ece?utm_source=RSS_Feed&utm_medium=RSS&utm_campaign=RSS_Syndication","Thu, 29 Dec 2016 01:17:57 +0530","rise in the water level of gandikota reservoir threatens to inundate 22 villages"
"HIN299","bumrah quietly preparing for the big occasion","http://www.thehindu.com/sport/Bumrah-quietly-preparing-for-the-big-occasion/article16956307.ece?utm_source=RSS_Feed&utm_medium=RSS&utm_campaign=RSS_Syndication","Thu, 29 Dec 2016 01:16:36 +0530","cricket the pacer has been a revelation in the shorter formats"
"HIN300","visakha utsav rescheduled","http://www.thehindu.com/news/cities/Visakhapatnam/Visakha-Utsav-rescheduled/article16956298.ece?utm_source=RSS_Feed&utm_medium=RSS&utm_campaign=RSS_Syndication","Thu, 29 Dec 2016 01:15:22 +0530","chief minister to inaugurate the carnival on january 28"
"HIN301","railways storms into both semifinals","http://www.thehindu.com/sport/Railways-storms-into-both-semifinals/article16956295.ece?utm_source=RSS_Feed&utm_medium=RSS&utm_campaign=RSS_Syndication","Thu, 29 Dec 2016 01:15:11 +0530","railways men and women entered the semifinals of the senior national volleyball championship for the third time in a row here on wednesday the mens team got past andhra pradesh 25 20 25 20 25 23"
"HIN302","still frowning upon intermarriages","http://www.thehindu.com/opinion/op-ed/Still-frowning-upon-intermarriages/article16955131.ece?utm_source=RSS_Feed&utm_medium=RSS&utm_campaign=RSS_Syndication","Thu, 29 Dec 2016 18:32:41 +0530","a survey in two diverse areas shows that the desire to stop other people from having inter caste or inter religious marriages is not as uncommon as we might like to think"
"HIN303","cpi to modi come clean on sahara birla payoffs","http://www.thehindu.com/news/national/andhra-pradesh/CPI-to-Modi-come-clean-on-Sahara-Birla-%E2%80%98payoffs%E2%80%99/article16956282.ece?utm_source=RSS_Feed&utm_medium=RSS&utm_campaign=RSS_Syndication","Thu, 29 Dec 2016 01:14:12 +0530","vijayawada cpi general secretary suravaram sudhakar reddy has said that prime minister narendra modi who takes pride in describing demonetisation as a bold move against corruption should first prov"
"HIN304","i have no expectations this time coric","http://www.thehindu.com/sport/I-have-no-expectations-this-time-Coric/article16956279.ece?utm_source=RSS_Feed&utm_medium=RSS&utm_campaign=RSS_Syndication","Thu, 29 Dec 2016 01:14:02 +0530","borna coric was the atp star of tomorrow in 2014 a year after he turned pro playing carefree without any inhibitions he has grown in stature since then defeating the likes of andy murray last y"
"HIN305","myanmar drafts bill to criminalise gang rape domestic violence","http://www.thehindu.com/news/international/Myanmar-drafts-bill-to-criminalise-gang-rape-domestic-violence/article16956272.ece?utm_source=RSS_Feed&utm_medium=RSS&utm_campaign=RSS_Syndication","Thu, 29 Dec 2016 01:13:04 +0530","myanmars government is drafting a law that could see men jailed for up to seven years for getting a woman pregnant but not marrying her a senior official said on wednesday the provision is part of"
"HIN306","use apps for better sanitation","http://www.thehindu.com/news/cities/Visakhapatnam/%E2%80%98Use-apps-for-better-sanitation%E2%80%99/article16956269.ece?utm_source=RSS_Feed&utm_medium=RSS&utm_campaign=RSS_Syndication","Thu, 29 Dec 2016 01:12:58 +0530","besides making use of other modes available for grievance redressal in gvmc citizens may also make complaints on sanitation using two apps complaintsboth smart visakha app and the recently introduce"
"HIN307","vijay goel felicitates junior mens team","http://www.thehindu.com/sport/hockey/Vijay-Goel-felicitates-junior-men%E2%80%99s-team/article16956262.ece?utm_source=RSS_Feed&utm_medium=RSS&utm_campaign=RSS_Syndication","Thu, 29 Dec 2016 01:12:34 +0530","hockey players left disappointed at not being able to meet the prime minister"
"HIN308","suspension of eight students triggers protests","http://www.thehindu.com/news/cities/Delhi/Suspension-of-eight-students-triggers-protests/article16956255.ece?utm_source=RSS_Feed&utm_medium=RSS&utm_campaign=RSS_Syndication","Thu, 29 Dec 2016 01:11:54 +0530","the jawaharlal nehru university campus and the ministry of human resource development were witness to agitations on wednesday against the universitys decision to suspend students who protested at th"
"HIN309","appcb to launch app soon official","http://www.thehindu.com/news/cities/Visakhapatnam/APPCB-to-launch-app-soon-Official/article16956245.ece?utm_source=RSS_Feed&utm_medium=RSS&utm_campaign=RSS_Syndication","Thu, 29 Dec 2016 01:11:41 +0530","visakhapatnam the a p pollution control board appcb will soon launch an app to know the pollution levels of red category industries in the state its member secretary b s s prasad has said the"
"HIN310","amu students seek cbi probe into najeebs disappearance","http://www.thehindu.com/news/cities/Delhi/AMU-students-seek-CBI-probe-into-Najeeb%E2%80%99s-disappearance/article16956243.ece?utm_source=RSS_Feed&utm_medium=RSS&utm_campaign=RSS_Syndication","Thu, 29 Dec 2016 01:10:49 +0530","a memorandum has been sent to president pranab mukherjee"
"HIN311","probe began 10 months ago no charge sheet yet","http://www.thehindu.com/news/cities/Delhi/Probe-began-10-months-ago-no-charge-sheet-yet/article16956240.ece?utm_source=RSS_Feed&utm_medium=RSS&utm_campaign=RSS_Syndication","Thu, 29 Dec 2016 01:10:36 +0530","the special cell of the delhi police created a stir 10 months ago when it arrested then jnusu president kanhaiya kumar and two others anirban bhattacharya and umar khalid on charges of sedition"
"HIN312","jnus journey from prestigious to anti national","http://www.thehindu.com/news/cities/Delhi/JNU%E2%80%99s-journey-from-%E2%80%98prestigious%E2%80%99-to-%E2%80%98anti-national%E2%80%99/article16956239.ece?utm_source=RSS_Feed&utm_medium=RSS&utm_campaign=RSS_Syndication","Thu, 29 Dec 2016 01:10:16 +0530","the university has made its presence felt on the national political stage with a series of protests over various issues"
"HIN313","obama abe decry horrors of war at pearl harbor","http://www.thehindu.com/news/international/Obama-Abe-decry-horrors-of-war-at-Pearl-Harbor/article16956232.ece?utm_source=RSS_Feed&utm_medium=RSS&utm_campaign=RSS_Syndication","Thu, 29 Dec 2016 01:09:52 +0530","shinzo abe becomes the first sitting japanese prime minister to pay homage at pearl harbor memorial site"
"HIN314","kolagatla resigns as ysrc district president","http://www.thehindu.com/news/national/andhra-pradesh/Kolagatla-resigns-as-YSRC-district-president/article16956217.ece?utm_source=RSS_Feed&utm_medium=RSS&utm_campaign=RSS_Syndication","Thu, 29 Dec 2016 01:07:19 +0530","vizianagaram ysr congress district president kolagatla veerabhadra swamy resigned from the post on wednesday a copy of his resignation letter was released to the media while thanking party presiden"
"HIN315","polavaram evacuees stage rasta roko traffic disrupted","http://www.thehindu.com/news/national/andhra-pradesh/Polavaram-evacuees-stage-rasta-roko-traffic-disrupted/article16956212.ece?utm_source=RSS_Feed&utm_medium=RSS&utm_campaign=RSS_Syndication","Thu, 29 Dec 2016 01:04:56 +0530","devipatnam east godavari the polavaram project evacuees association on wednesday staged a rasta roko in the submerged mandals of the agency area demanding package for the displaced as per the new"
"HIN316","berlin truck attacker went via netherlands and france to italy","http://www.thehindu.com/news/international/Berlin-truck-attacker-went-via-Netherlands-and-France-to-Italy/article16956209.ece?utm_source=RSS_Feed&utm_medium=RSS&utm_campaign=RSS_Syndication","Thu, 29 Dec 2016 01:00:41 +0530","suspected berlin truck attacker anis amri travelled by bus from the netherlands to france before heading to italy where police shot him dead sources close to the investigation said on wednesday two"
"HIN317","truck mounted telescopic belt conveyor for spillway concrete","http://www.thehindu.com/news/national/andhra-pradesh/Truck-mounted-telescopic-belt-conveyor-for-spillway-concrete/article16956206.ece?utm_source=RSS_Feed&utm_medium=RSS&utm_campaign=RSS_Syndication","Thu, 29 Dec 2016 00:59:28 +0530","vijayawada chief minister n chandrababu naidu will use a state of the art truck mounted telescopic belt conveyor to put concrete on the polavaram spillway on friday the putzmeister telebelt used f"
