"id","title","link","pubDate","desc"
"HIN436","chaos reigns on stretches of gst road","http://www.thehindu.com/news/cities/chennai/Chaos-reigns-on-stretches-of-GST-Road/article16951835.ece?utm_source=RSS_Feed&utm_medium=RSS&utm_campaign=RSS_Syndication","Wed, 28 Dec 2016 01:21:58 +0530","commuters blame unregulated parking by share autorickshaws and maxi cab operators"
"HIN437","two arrested in mahindra park murder case","http://www.thehindu.com/news/cities/Delhi/Two-arrested-in-Mahindra-Park-murder-case/article16951832.ece?utm_source=RSS_Feed&utm_medium=RSS&utm_campaign=RSS_Syndication","Wed, 28 Dec 2016 01:21:47 +0530","a day after a witness in a murder case was allegedly shot dead by unidentified assailants in mahindra park the police claimed to have arrested two people in connection with the case deputy commissi"
"HIN438","air traffic controller faces the heat","http://www.thehindu.com/news/cities/Delhi/Air-traffic-controller-faces-the-heat/article16951828.ece?utm_source=RSS_Feed&utm_medium=RSS&utm_campaign=RSS_Syndication","Wed, 28 Dec 2016 01:21:20 +0530","aviation regulator dgca has derostered an air traffic controller atc over the incident in which two fully loaded passenger aircraft came face to face on a taxiway at the delhi airport here on tues"
"HIN439","aadhaar linked entry at igia soon","http://www.thehindu.com/news/cities/Delhi/Aadhaar-linked-entry-at-IGIA-soon/article16951822.ece?utm_source=RSS_Feed&utm_medium=RSS&utm_campaign=RSS_Syndication","Wed, 28 Dec 2016 01:21:01 +0530","beginning next year employees of the indira gandhi international airport here will have to compulsorily carry their aadhaar cards to gain entry into the premises cisf officers said the guidelines h"
"HIN440","tb employees seek risk allowance insurance cover","http://www.thehindu.com/news/cities/chennai/TB-employees-seek-risk-allowance-insurance-cover/article16951821.ece?utm_source=RSS_Feed&utm_medium=RSS&utm_campaign=RSS_Syndication","Wed, 28 Dec 2016 01:20:55 +0530","the tamil nadu tuberculosis employees association wants the state health department to provide financial support to the families of employees who die on duty this year three workers died but their"
"HIN441","nearly 4 500 special buses to be operated for pongal","http://www.thehindu.com/news/cities/chennai/Nearly-4500-special-buses-to-be-operated-for-Pongal/article16951819.ece?utm_source=RSS_Feed&utm_medium=RSS&utm_campaign=RSS_Syndication","Wed, 28 Dec 2016 07:18:57 +0530","as many as 4 445 special buses will be operated by the government from chennai on january 11 12 and 13 to meet the additional rush of passengers during the pongal season apart from the 2 275 schedu"
"HIN442","swaraj india attacks govt over discrepancies","http://www.thehindu.com/news/cities/Delhi/Swaraj-India-attacks-govt-over-%E2%80%98discrepancies%E2%80%99/article16951818.ece?utm_source=RSS_Feed&utm_medium=RSS&utm_campaign=RSS_Syndication","Wed, 28 Dec 2016 01:19:54 +0530","swaraj india the yogendra yadav led fledgling party on tuesday rubbished aap s claim that it had removed the list of donors from the party website as authorities were targeting them terming the ex"
"HIN443","over 32 000 electricity poles replaced after cyclone vardah","http://www.thehindu.com/news/cities/chennai/Over-32000-electricity-poles-replaced-after-Cyclone-Vardah/article16951813.ece?utm_source=RSS_Feed&utm_medium=RSS&utm_campaign=RSS_Syndication","Wed, 28 Dec 2016 01:19:42 +0530","loss from uprooted poles alone is over 65 crore says tangedco"
"HIN444","e godavari zp seeks action against deo","http://www.thehindu.com/news/national/andhra-pradesh/E.-Godavari-ZP-seeks-action-against-DEO/article16951804.ece?utm_source=RSS_Feed&utm_medium=RSS&utm_campaign=RSS_Syndication","Wed, 28 Dec 2016 01:19:12 +0530","elected representatives from the ruling telugu desam party have expressed dissatisfaction over the functioning of the officials during the budget session of the zilla parishad and passed a resolution"
"HIN445","chain snatcher held in k k nagar","http://www.thehindu.com/news/cities/chennai/Chain-snatcher-held-in-K.K.-Nagar/article16951803.ece?utm_source=RSS_Feed&utm_medium=RSS&utm_campaign=RSS_Syndication","Wed, 28 Dec 2016 01:19:10 +0530","a 23 year old vendor of old newspapers was arrested within four hours of snatching a gold chain from a woman residing in the cpwd quarters in k k nagar a police officer of the k k nagar police sai"
"HIN446","aap says income tax notice on donors list malicious","http://www.thehindu.com/news/cities/Delhi/AAP-says-Income-Tax-notice-on-donors%E2%80%99-list-%E2%80%98malicious%E2%80%99/article16951798.ece?utm_source=RSS_Feed&utm_medium=RSS&utm_campaign=RSS_Syndication","Wed, 28 Dec 2016 01:18:47 +0530","i t notice on donors list malicious says aap"
"HIN447","sdmc spending less on civic amenities","http://www.thehindu.com/news/cities/Delhi/%E2%80%98SDMC-spending-less-on-civic-amenities%E2%80%99/article16951794.ece?utm_source=RSS_Feed&utm_medium=RSS&utm_campaign=RSS_Syndication","Wed, 28 Dec 2016 01:17:49 +0530","congress alleges corporation has failed to utilise money it allocated for obligatory functions"
"HIN448","bjp tells kejriwal to resign","http://www.thehindu.com/news/cities/Delhi/BJP-tells-Kejriwal-to-resign/article16951792.ece?utm_source=RSS_Feed&utm_medium=RSS&utm_campaign=RSS_Syndication","Wed, 28 Dec 2016 01:17:28 +0530","state bjp president manoj tiwari on tuesday demanded chief minister arvind kejriwal s resignation over alleged irregularities in the party s funding three accountsalleging that the party stood vindic"
"HIN449","shortage of e pos machines hits digitisation in east godavari","http://www.thehindu.com/news/national/andhra-pradesh/Shortage-of-e-PoS-machines-hits-digitisation-in-East-Godavari/article16951787.ece?utm_source=RSS_Feed&utm_medium=RSS&utm_campaign=RSS_Syndication","Wed, 28 Dec 2016 01:17:07 +0530","farmers in bazaars face the heat due to delay"
"HIN450","i t officials didnt break rules say experts","http://www.thehindu.com/news/national/tamil-nadu/I-T-officials-didn%E2%80%99t-break-rules-say-experts/article16951780.ece?utm_source=RSS_Feed&utm_medium=RSS&utm_campaign=RSS_Syndication","Wed, 28 Dec 2016 07:57:33 +0530","lawyers practising in the madras high court bench here say that the income tax act 1961 confers powers on officials to conduct searches in any building vessel or even an aircraft after compelling"
"HIN451","weighing scales will take the weight of fliers minds","http://www.thehindu.com/news/national/tamil-nadu/Weighing-scales-will-take-the-weight-of-fliers-minds/article16951779.ece?utm_source=RSS_Feed&utm_medium=RSS&utm_campaign=RSS_Syndication","Wed, 28 Dec 2016 01:16:38 +0530","its a minor feature but one that will be of immense benefit to passengers taking flights out of chennai particularly those travelling abroad chennai airport is planing to set up weighing scales o"
"HIN452","court dismisses pothys pleaagainst eds attachment order","http://www.thehindu.com/news/cities/chennai/Court-dismisses-Pothys%E2%80%99-pleaagainst-ED%E2%80%99s-attachment-order/article16951778.ece?utm_source=RSS_Feed&utm_medium=RSS&utm_campaign=RSS_Syndication","Wed, 28 Dec 2016 01:16:11 +0530","textile chain had challenged attachment of property under money laundering act"
"HIN453","inter state red sanders smuggler arrested","http://www.thehindu.com/news/national/andhra-pradesh/Inter-State-red-sanders-smuggler-arrested/article16951763.ece?utm_source=RSS_Feed&utm_medium=RSS&utm_campaign=RSS_Syndication","Wed, 28 Dec 2016 01:15:51 +0530","police arrested an inter state red sanders smuggler aslam khan 56 of karnataka near nadimpalli village in lakkireddipalle mandal in kadapa district on tuesday and seized 11 red sanders logs and a"
"HIN454","nothing much to cheer for industries in 2016","http://www.thehindu.com/news/national/andhra-pradesh/Nothing-much-to-cheer-for-industries-in-2016/article16951752.ece?utm_source=RSS_Feed&utm_medium=RSS&utm_campaign=RSS_Syndication","Wed, 28 Dec 2016 01:14:26 +0530","economic slowdown denial of benefits under special category status and demonetisation hit investment proposals in north andhra"
"HIN455","astronomer vera rubin passes away at 88","http://www.thehindu.com/news/international/Astronomer-Vera-Rubin-passes-away-at-88/article16951743.ece?utm_source=RSS_Feed&utm_medium=RSS&utm_campaign=RSS_Syndication","Wed, 28 Dec 2016 01:13:15 +0530","vera rubin a pioneering astronomer who helped find powerful evidence of dark matter has died she was 88 allan rubin a professor of geosciences at princeton university said his mother died on su"
"HIN456","obulavaripalle krishnapatnam port rail link by dec 2017 venkaiah","http://www.thehindu.com/news/national/andhra-pradesh/Obulavaripalle-Krishnapatnam-port-rail-link-by-Dec.-2017-Venkaiah/article16951731.ece?utm_source=RSS_Feed&utm_medium=RSS&utm_campaign=RSS_Syndication","Wed, 28 Dec 2016 01:12:08 +0530","the obulavaripalle krishnapuram port broad gauge railway line connectivity work in kadapa district would be completed by december next said union minister for urban development m venkaiah naidu on"
"HIN457","2 youths killed in accident","http://www.thehindu.com/news/cities/Visakhapatnam/2-youths-killed-in-accident/article16951726.ece?utm_source=RSS_Feed&utm_medium=RSS&utm_campaign=RSS_Syndication","Wed, 28 Dec 2016 01:11:28 +0530","two youths died on the spot and one was critically injured in a road accident under the anakapalle town police station limits in the wee hours of tuesday the deceased were identified as p siva tej"
"HIN458","i t raid on ex mci member","http://www.thehindu.com/news/national/andhra-pradesh/I-T-raid-on-ex-MCI-member/article16951721.ece?utm_source=RSS_Feed&utm_medium=RSS&utm_campaign=RSS_Syndication","Wed, 28 Dec 2016 01:09:56 +0530","sleuths of the income tax department raided the premises of gunasekhar yadav former member of the medical council of india mci here on tuesday an alumnus of sri venkateswara medical college he"
"HIN459","kleptomania a personalitydisorder says expert","http://www.thehindu.com/news/cities/Visakhapatnam/Kleptomania-a-personalitydisorder-says-expert/article16951718.ece?utm_source=RSS_Feed&utm_medium=RSS&utm_campaign=RSS_Syndication","Wed, 28 Dec 2016 01:09:14 +0530","on sunday deputy executive engineer of roads and buildings electrical sub division subhas chandra patro was arrested by the central investigation unit ciu of anti corruption bureau acb for amas"
"HIN460","demonetisation turns prospects blurry for varanasi lenswoman","http://www.thehindu.com/news/national/Demonetisation-turns-prospects-blurry-for-Varanasi-lenswoman/article16951716.ece?utm_source=RSS_Feed&utm_medium=RSS&utm_campaign=RSS_Syndication","Wed, 28 Dec 2016 01:08:40 +0530","sita sahani offers a snapshot of life in the time of note bans and smartphones"
"HIN461","college that produced stalwarts like c v raman alluri","http://www.thehindu.com/news/cities/Visakhapatnam/College-that-produced-stalwarts-like-C.V.-Raman-Alluri/article16951693.ece?utm_source=RSS_Feed&utm_medium=RSS&utm_campaign=RSS_Syndication","Wed, 28 Dec 2016 01:07:15 +0530","mrs a v n college celebrates foundation day"
"HIN462","mori to be declared fully digital village","http://www.thehindu.com/news/national/andhra-pradesh/Mori-to-be-declared-fully-digital-village/article16951690.ece?utm_source=RSS_Feed&utm_medium=RSS&utm_campaign=RSS_Syndication","Wed, 28 Dec 2016 01:07:22 +0530","this tiny cashew exporting village located near the bay of bengal in the east godavari district is all set to go fully digital with all the households enjoying wifi internet connectivity and cable t"
"HIN463","karimnagar police to roll out e challans","http://www.thehindu.com/news/national/telangana/Karimnagar-police-to-roll-out-e-challans/article16951216.ece?utm_source=RSS_Feed&utm_medium=RSS&utm_campaign=RSS_Syndication","Wed, 28 Dec 2016 00:07:18 +0530","next time when you are caught by the traffic police for violation of rules you will have to digitally sign the fine receipt and collect the print out on the spot the karimnagar commissionerate is in"
"HIN464","fire disaster management training institute to come up","http://www.thehindu.com/news/cities/Visakhapatnam/Fire-disaster-management-training-institute-to-come-up/article16951684.ece?utm_source=RSS_Feed&utm_medium=RSS&utm_campaign=RSS_Syndication","Wed, 28 Dec 2016 01:05:30 +0530","plans are afoot to train private security staff in industries says dg"
"HIN465","trs mlas charge against diwakar travels takes serious turn","http://www.thehindu.com/news/cities/Hyderabad/TRS-MLA%E2%80%99s-charge-against-Diwakar-Travels-takes-serious-turn/article16951215.ece?utm_source=RSS_Feed&utm_medium=RSS&utm_campaign=RSS_Syndication","Wed, 28 Dec 2016 00:05:58 +0530","the ongoing war of words between telangana rashtra samiti legislator v srinivas goud on the illicit operations by diwakar travels owned by family members of tdp mp j c diwakar reddy took a seri"
"HIN466","victims cant state facts like parrot says court","http://www.thehindu.com/news/cities/Delhi/Victims-can%E2%80%99t-state-facts-like-parrot-says-court/article16951680.ece?utm_source=RSS_Feed&utm_medium=RSS&utm_campaign=RSS_Syndication","Wed, 28 Dec 2016 01:04:33 +0530","victims cannot be expected to state facts in a parrot like manner and minor contradictions are bound to happen after a lapse of time a court here said while sending four men to jail in a molestat"
"HIN467","police register murder case in aiims doctors death","http://www.thehindu.com/news/cities/Delhi/Police-register-murder-case-in-AIIMS-doctor%E2%80%99s-death/article16951676.ece?utm_source=RSS_Feed&utm_medium=RSS&utm_campaign=RSS_Syndication","Wed, 28 Dec 2016 01:04:14 +0530","the police on tuesday registered a murder case against unnamed persons in connection with the death of a 26 year old junior resident doctor who had been pursuing md at aiims in south delhi in july s"
"HIN468","stage set for faridabad civic polls","http://www.thehindu.com/news/cities/Delhi/Stage-set-for-Faridabad-civic-polls/article16951672.ece?utm_source=RSS_Feed&utm_medium=RSS&utm_campaign=RSS_Syndication","Wed, 28 Dec 2016 01:03:44 +0530","congress bjp ready strategy talk issues that could swing the election"
"HIN469","belt shops bane of peda jalaripeta","http://www.thehindu.com/news/cities/Visakhapatnam/Belt-shops-bane-of-Peda-Jalaripeta/article16951658.ece?utm_source=RSS_Feed&utm_medium=RSS&utm_campaign=RSS_Syndication","Wed, 28 Dec 2016 01:03:27 +0530","men spend major portion of income on alcohol say fisherwomen"
"HIN470","bamboo brings a breath of fresh talent","http://www.thehindu.com/news/cities/puducherry/Bamboo-brings-a-breath-of-fresh-talent/article16951655.ece?utm_source=RSS_Feed&utm_medium=RSS&utm_campaign=RSS_Syndication","Wed, 28 Dec 2016 01:03:14 +0530","mohanam helps rural youth to connect to their original culture the bamboo boys of aurovillethis is bamboozling variety for surethe bamboo is touching our lives in more ways than we imagine food soa"
"HIN471","cghs wellness centre gets ready","http://www.thehindu.com/news/cities/Visakhapatnam/CGHS-Wellness-Centre-gets-ready/article16951638.ece?utm_source=RSS_Feed&utm_medium=RSS&utm_campaign=RSS_Syndication","Wed, 28 Dec 2016 01:02:16 +0530","a long pending dream of serving and retired central government employees and their family members is set to come true in the new year a cghs central government health scheme wellness centre has be"
"HIN472","cpi m opposes la amendments bill","http://www.thehindu.com/news/cities/Hyderabad/CPIM-opposes-LA-amendments-Bill/article16951210.ece?utm_source=RSS_Feed&utm_medium=RSS&utm_campaign=RSS_Syndication","Wed, 28 Dec 2016 00:01:19 +0530","hyderabad a delegation from the communist party of india marxist telangana met president pranab mukherjee on tuesday and submitted a memorandum urging him not to accord approval to the amendments"
"HIN473","fake currency racket busted","http://www.thehindu.com/news/cities/Visakhapatnam/Fake-currency-racket-busted/article16951631.ece?utm_source=RSS_Feed&utm_medium=RSS&utm_campaign=RSS_Syndication","Wed, 28 Dec 2016 01:00:29 +0530","the arilova police have arrested two persons of a three member gang who were printing new currency using a printing machine and trying to circulate them the arrested were identified as m satyanarayan"
"HIN474","cs for prioritising employment schemes","http://www.thehindu.com/news/cities/Hyderabad/CS-for-prioritising-employment-schemes/article16951203.ece?utm_source=RSS_Feed&utm_medium=RSS&utm_campaign=RSS_Syndication","Wed, 28 Dec 2016 00:00:11 +0530","telangana chief secretary pradeep chandra has asked officials concerned to give priority to self employment schemes already sanctioned and selection of beneficiaries completed reviewing the progress"
"HIN475","metro network grows bigger more hi tech","http://www.thehindu.com/news/cities/Delhi/Metro-network-grows-bigger-more-hi-tech/article16951614.ece?utm_source=RSS_Feed&utm_medium=RSS&utm_campaign=RSS_Syndication","Wed, 28 Dec 2016 00:59:55 +0530","the year 2016 saw the delhi metro make steady progress in its phase iii expansion project even though no new sections were opened to the public apart from the dmrc trying to complete phase iii corrid"
"HIN476","finally siddaramaiah gets appointment with pm","http://www.thehindu.com/news/national/karnataka/Finally-Siddaramaiah-gets-appointment-with-PM/article16951606.ece?utm_source=RSS_Feed&utm_medium=RSS&utm_campaign=RSS_Syndication","Wed, 28 Dec 2016 00:59:32 +0530","chief minister siddaramaiah is finally set to meet prime minister narendra modi on friday to discuss drought in karnataka and seek more funds for relief work the chief minister had failed to get an a"
"HIN477","adishakti to host ravana samharam","http://www.thehindu.com/news/cities/puducherry/Adishakti-to-host-%E2%80%98Ravana-Samharam%E2%80%99/article16951605.ece?utm_source=RSS_Feed&utm_medium=RSS&utm_campaign=RSS_Syndication","Wed, 28 Dec 2016 00:59:32 +0530","the therukoothu will be performed by iyyappan nataka mandrampuducherry the folk theatre of north tamil nadu is here for the public to reminisce the rich tradition on wednesday adishakti laboratory"
"HIN478","ncrpb releases funds for noida metro project","http://www.thehindu.com/news/cities/Delhi/NCRPB-releases-funds-for-Noida-metro-project/article16951597.ece?utm_source=RSS_Feed&utm_medium=RSS&utm_campaign=RSS_Syndication","Wed, 28 Dec 2016 00:59:26 +0530","the national capital region planning board ncrpb has begun to release funds for the noida greater noida metro project by disbursing the first loan instalment of rs 406 crore giving a fillip to the"
"HIN479","govt mulls introducing buses of different sizes","http://www.thehindu.com/news/cities/Delhi/Govt-mulls-introducing-buses-of-different-sizes/article16951592.ece?utm_source=RSS_Feed&utm_medium=RSS&utm_campaign=RSS_Syndication","Wed, 28 Dec 2016 00:59:12 +0530","the delhi government is likely to introduce different sized buses including midi and mini buses in the citys public transport network to cater to the specific requirements of certain routes the go"
"HIN480","construction of signature bridge resumes mukundpur flyover opens","http://www.thehindu.com/news/cities/Delhi/Construction-of-Signature-Bridge-resumes-Mukundpur-flyover-opens/article16951581.ece?utm_source=RSS_Feed&utm_medium=RSS&utm_campaign=RSS_Syndication","Wed, 28 Dec 2016 00:58:53 +0530","in addition to embarking on a city wide road renovation exercise to pre empt water logging and traffic congestion complaints well before monsoon arrives next year the delhi governments public works"
"HIN481","improve soft skills students told","http://www.thehindu.com/news/cities/Visakhapatnam/Improve-soft-skills-students-told/article16951570.ece?utm_source=RSS_Feed&utm_medium=RSS&utm_campaign=RSS_Syndication","Wed, 28 Dec 2016 00:58:43 +0530","unless students overcome diffidence and improve communication skills in english they can not take full advantage of their knowledge in other subjects executive director hpcl visakh refinery g v s"
"HIN482","a year of odd even lessons for motorists govt","http://www.thehindu.com/news/cities/Delhi/A-year-of-odd-even-lessons-for-motorists-govt/article16951568.ece?utm_source=RSS_Feed&utm_medium=RSS&utm_campaign=RSS_Syndication","Wed, 28 Dec 2016 00:58:41 +0530","two instalments of car rationing scheme received mixed response from delhiites metro gained popularity as an alternative mode of transport"
"HIN483","brt gets demolished","http://www.thehindu.com/news/cities/Delhi/BRT-gets-demolished/article16951562.ece?utm_source=RSS_Feed&utm_medium=RSS&utm_campaign=RSS_Syndication","Wed, 28 Dec 2016 00:58:00 +0530","this year the capital finally bid farewell to the bus rapid transit brt corridor which had over the eight years of its existence between ambedkar nagar and moolchand emerged as a nightmare for c"
"HIN484","chegg india prospecta join campaign to go cashless","http://www.thehindu.com/news/cities/Visakhapatnam/Chegg-India-Prospecta-join-campaign-to-go-cashless/article16951552.ece?utm_source=RSS_Feed&utm_medium=RSS&utm_campaign=RSS_Syndication","Wed, 28 Dec 2016 00:57:26 +0530","responding to the government s call for demonetisation the employees of chegg india leading student first connected learning platform and prospecta technologies it firm took a pledge to go cashle"
"HIN485","pay additional incentive for milk unions told","http://www.thehindu.com/news/national/karnataka/Pay-additional-incentive-for-milk-unions-told/article16951547.ece?utm_source=RSS_Feed&utm_medium=RSS&utm_campaign=RSS_Syndication","Wed, 28 Dec 2016 00:57:12 +0530","in the wake of severe drought in 139 taluks the government has directed all 14 milk unions in the state to provide extra incentive of 1 to 2 a litre of milk to producers depending on their profit"
"HIN486","pending road works irk ayyanna","http://www.thehindu.com/news/cities/Visakhapatnam/Pending-road-works-irk-Ayyanna/article16951541.ece?utm_source=RSS_Feed&utm_medium=RSS&utm_campaign=RSS_Syndication","Wed, 28 Dec 2016 00:55:30 +0530","panchayat raj minister ch ayyanna patrudu has warned of stern action against engineering officials and contractors if they fail to complete 45 of the 92 pending roads under pm gramin sadak yojana by"
"HIN487","need for yarn bank in sircilla stressed","http://www.thehindu.com/news/national/telangana/Need-for-yarn-bank-in-Sircilla-stressed/article16951535.ece?utm_source=RSS_Feed&utm_medium=RSS&utm_campaign=RSS_Syndication","Wed, 28 Dec 2016 00:54:17 +0530","entrepreneurs and powerloom weavers told to utilise central schemes"
"HIN488","new currency notes seized","http://www.thehindu.com/news/cities/Visakhapatnam/New-currency-notes-seized/article16951527.ece?utm_source=RSS_Feed&utm_medium=RSS&utm_campaign=RSS_Syndication","Wed, 28 Dec 2016 00:53:41 +0530","the city task force ctf team led by acp i chittibabu seized rs 13 lakh of new currency notes in denominations of rs 2 000 rs 100 and rs 50 from a person in gajuwaka on tuesday the arrested w"
"HIN489","hundred villages in sangareddy will go cashless by sankranti collector","http://www.thehindu.com/news/national/telangana/Hundred-villages-in-Sangareddy-will-go-cashless-by-Sankranti-Collector/article16951526.ece?utm_source=RSS_Feed&utm_medium=RSS&utm_campaign=RSS_Syndication","Wed, 28 Dec 2016 00:53:29 +0530","the district administration is taking necessary steps to make 100 villages go for cashless transactions by sankranti disclosing this at a press conference here on tuesday collector manickaraj kannan"
"HIN490","eshwarappa fails to find place in bjp drought study teams","http://www.thehindu.com/news/national/karnataka/Eshwarappa-fails-to-find-place-in-BJP-drought-study-teams/article16951520.ece?utm_source=RSS_Feed&utm_medium=RSS&utm_campaign=RSS_Syndication","Wed, 28 Dec 2016 00:52:34 +0530","k s eshwarappa leader of the opposition in the legislative council has failed to make it to teams formed by the bjp to study the drought situation in the state and this has gained significance in"
"HIN491","pacers script hyderabads ranji campaign","http://www.thehindu.com/news/cities/Hyderabad/Pacers-script-Hyderabad%E2%80%99s-Ranji-campaign/article16951514.ece?utm_source=RSS_Feed&utm_medium=RSS&utm_campaign=RSS_Syndication","Wed, 28 Dec 2016 00:51:26 +0530","beaten but not disgraced well this is how one may sum up hyderabads campaign in ranji trophy this season which ended in a loss to 41 times champion mumbai in the quarter final in raipur on tues"
"HIN492","karnataka govt announces support price for toor to counter drought demonetisation","http://www.thehindu.com/news/national/karnataka/Karnataka-Govt.-announces-support-price-for-toor-to-counter-drought-demonetisation/article16951508.ece?utm_source=RSS_Feed&utm_medium=RSS&utm_campaign=RSS_Syndication","Wed, 28 Dec 2016 00:50:56 +0530","following the crash in prices of toor in the open market the state cabinet has decided to procure the commodity from growers by paying a support price of 450 per quintal with this the farmers wou"
"HIN493","protests force ecor to convert suvidha into tatkal","http://www.thehindu.com/news/cities/Visakhapatnam/Protests-force-ECoR-to-convert-Suvidha-into-Tatkal/article16951493.ece?utm_source=RSS_Feed&utm_medium=RSS&utm_campaign=RSS_Syndication","Wed, 28 Dec 2016 00:50:06 +0530","the east coast railway ecor authorities had to beat a hasty retreat and issue a revised notice on tuesday after irate rail users took to twitter to express their ire on its announcement on continu"
