"id","title","link","pubDate","desc"
"HIN614","government to increase garbage cess","http://www.thehindu.com/news/cities/bangalore/Government-to-increase-garbage-cess/article16950394.ece?utm_source=RSS_Feed&utm_medium=RSS&utm_campaign=RSS_Syndication","Tue, 27 Dec 2016 20:58:30 +0530","will be fixed at 15 per cent of the property tax"
"HIN615","congress worker shot at by militants in kashmir","http://www.thehindu.com/news/national/other-states/Congress-worker-shot-at-by-militants-in-Kashmir/article16950391.ece?utm_source=RSS_Feed&utm_medium=RSS&utm_campaign=RSS_Syndication","Tue, 27 Dec 2016 21:02:58 +0530","militants shot at and injured a congress worker in bandipora district of kashmir on tuesday night police said the militants shot baahir ahmad shiekh 40 inside his residence at ashtengoo at around 7"
"HIN616","gangster ayyub khan made fake passport while in jail","http://www.thehindu.com/news/cities/Hyderabad/Gangster-Ayyub-Khan-made-fake-passport-while-in-jail/article16950378.ece?utm_source=RSS_Feed&utm_medium=RSS&utm_campaign=RSS_Syndication","Tue, 27 Dec 2016 20:53:00 +0530","mohammed ayyub khan the gangster who was involved in 72 cases in the city and arrested in mumbai on monday had managed to make a fake passport for himself in 2010 while he was serving a prison term"
"HIN617","try to bring about large scale industries l ganesan urged","http://www.thehindu.com/news/cities/Madurai/Try-to-bring-about-large-scale-industries-L.-Ganesan-urged/article16950357.ece?utm_source=RSS_Feed&utm_medium=RSS&utm_campaign=RSS_Syndication","Tue, 27 Dec 2016 20:50:03 +0530","madurai a large number of friends and well wishers of l ganesan the bjp national leader who was recently nominated to the rajya sabha as mp from madhya pradesh was felicitated here on tuesday und"
"HIN618","traffic curbs in city today tomorrow","http://www.thehindu.com/news/cities/Thiruvananthapuram/Traffic-curbs-in-city-today-tomorrow/article16950351.ece?utm_source=RSS_Feed&utm_medium=RSS&utm_campaign=RSS_Syndication","Tue, 27 Dec 2016 20:49:08 +0530","traffic regulations will be in place in the city on wednesday and thursday on account of vvip visits while union home minister rajnath singh is scheduled to attend a meeting of the southern zonal co"
"HIN619","country passing through a critical phase","http://www.thehindu.com/news/cities/Madurai/%E2%80%9CCountry-passing-through-a-critical-phase%E2%80%9D/article16950347.ece?utm_source=RSS_Feed&utm_medium=RSS&utm_campaign=RSS_Syndication","Tue, 27 Dec 2016 20:47:25 +0530","madurai referring to the increasing trend of branding everyone not agreeing with a particular line of thought as unpatriotic gopalkrishna gandhi former governor of west bengal said that india was"
"HIN620","curtains down on rowover olympic association","http://www.thehindu.com/news/national/andhra-pradesh/Curtains-down-on-rowover-Olympic-association/article16950335.ece?utm_source=RSS_Feed&utm_medium=RSS&utm_campaign=RSS_Syndication","Tue, 27 Dec 2016 20:43:18 +0530","vijayawada andhra pradesh olympic association vice president k pattabhi on tuesday said that the state government recognised andhra pradesh olympic association led by member of parliament galla jay"
"HIN621","jet airways flight veers off runway in goa","http://www.thehindu.com/videos/article16950311.ece?utm_source=RSS_Feed&utm_medium=RSS&utm_campaign=RSS_Syndication","Tue, 27 Dec 2016 20:38:34 +0530",""
"HIN622","new span on pamban bridge to be installed in june","http://www.thehindu.com/news/national/tamil-nadu/New-span-on-Pamban-bridge-to-be-installed-in-June/article16950306.ece?utm_source=RSS_Feed&utm_medium=RSS&utm_campaign=RSS_Syndication","Tue, 27 Dec 2016 20:36:09 +0530","pamban the century old scherzers span designed and installed at pamban rail bridge by a german engineer to allow vessels to pass through the channel would be replaced by an ultra modern vertically"
"HIN623","health minister promises rs 200 crore for nimhans north campus","http://www.thehindu.com/news/cities/bangalore/Health-Minister-promises-Rs.-200-crore-for-NIMHANS-north-campus/article16950294.ece?utm_source=RSS_Feed&utm_medium=RSS&utm_campaign=RSS_Syndication","Tue, 27 Dec 2016 20:32:38 +0530","his assurance came on tuesday at the 21st convocation of the institute during which 168 students received their degrees"
"HIN624","ttd gearing up to meet new year rush","http://www.thehindu.com/news/national/andhra-pradesh/TTD-gearing-up-to-meet-New-Year-rush/article16950289.ece?utm_source=RSS_Feed&utm_medium=RSS&utm_campaign=RSS_Syndication","Tue, 27 Dec 2016 20:27:16 +0530","tirumala elaborate arrangements are being made to meet the requirements of the pilgrims visiting the temple town of lord venkateswara on the eve of new year while vips will be allowed for the darshan"
"HIN625","our waste will fuel cement factories","http://www.thehindu.com/news/cities/bangalore/Our-waste-will-fuel-cement-factories/article16950268.ece?utm_source=RSS_Feed&utm_medium=RSS&utm_campaign=RSS_Syndication","Tue, 27 Dec 2016 20:11:39 +0530","kspcb brokers short term deal between bbmp and companies based in north karnataka"
"HIN626","sivagiri pilgrimage traffic restrictions in sivagiri from dec 30 to jan 1","http://www.thehindu.com/news/cities/Thiruvananthapuram/Sivagiri-pilgrimage-Traffic-restrictions-in-Sivagiri-from-Dec-30-to-Jan-1/article16950182.ece?utm_source=RSS_Feed&utm_medium=RSS&utm_campaign=RSS_Syndication","Tue, 27 Dec 2016 19:53:58 +0530","thiruvananthapuram the thiruvananthapuram rural police will implement various traffic regulations from december 30 to january 1 along the routes that lead to sivagiri mutt in varkala in connection wi"
"HIN627","u s backed force in syria advances towards is held dam","http://www.thehindu.com/news/international/U.S.-backed-force-in-Syria-advances-towards-IS-held-dam/article16950171.ece?utm_source=RSS_Feed&utm_medium=RSS&utm_campaign=RSS_Syndication","Tue, 27 Dec 2016 19:45:27 +0530","a u s backed alliance of militias has made unexpectedly rapid gains against islamic state near its syrian headquarters in raqqa advancing to within a few kilometres of a major dam its spokesman sa"
"HIN628","file fir in encounter case pucl","http://www.thehindu.com/news/national/kerala/File-FIR-in-%E2%80%98encounter-case%E2%80%99-PUCL/article16950162.ece?utm_source=RSS_Feed&utm_medium=RSS&utm_campaign=RSS_Syndication","Tue, 27 Dec 2016 19:34:13 +0530","human rights forum to petition govt today"
"HIN629","new law needed to protect cashless customers expert panel on digital payments","http://www.thehindu.com/business/Economy/New-law-needed-to-protect-cashless-customers-Expert-panel-on-digital-payments/article16950150.ece?utm_source=RSS_Feed&utm_medium=RSS&utm_campaign=RSS_Syndication","Tue, 27 Dec 2016 19:34:58 +0530","the governments cashless payment push needs to be urgently backed with legislative steps to protect customers and their data allow open access payment systems and let the payments regulatory board"
"HIN630","chennai smashers will do better this time sindhu","http://www.thehindu.com/sport/other-sports/Chennai-Smashers-will-do-better-this-time-Sindhu/article16950146.ece?utm_source=RSS_Feed&utm_medium=RSS&utm_campaign=RSS_Syndication","Wed, 28 Dec 2016 01:40:53 +0530","rio olympics silver medalist and indias top ranked singles player p v sindhu looking dapper and fit said she was looking forward to play for chennai smashers in the premier badminton league pbl"
"HIN631","aadimoolams sketches of tamil writers to make a fine calendar for 2017","http://www.thehindu.com/news/national/tamil-nadu/Aadimoolam%E2%80%99s-sketches-of-Tamil-writers-to-make-a-fine-calendar-for-2017/article16950129.ece?utm_source=RSS_Feed&utm_medium=RSS&utm_campaign=RSS_Syndication","Wed, 28 Dec 2016 07:11:10 +0530","a keepsake that can be a folio or framed into portraits after the year ends"
"HIN632","weaving tales of goodness","http://www.thehindu.com/life-and-style/fashion/Weaving-tales-of-goodness/article16946937.ece?utm_source=RSS_Feed&utm_medium=RSS&utm_campaign=RSS_Syndication","Tue, 27 Dec 2016 19:21:08 +0530","sustainable fashion gets a new friend in urmi a brand of handwoven accessories made of nondegradable plastic"
"HIN633","bescom payment kiosks will be back","http://www.thehindu.com/news/cities/bangalore/Bescom-payment-kiosks-will-be-back/article16950097.ece?utm_source=RSS_Feed&utm_medium=RSS&utm_campaign=RSS_Syndication","Tue, 27 Dec 2016 19:12:25 +0530","decision was prompted by feedback from customers and staff"
"HIN634","sensex posts biggest single day gain in 3 weeks gold cheers","http://www.thehindu.com/business/markets/Sensex-posts-biggest-single-day-gain-in-3-weeks-gold-cheers/article16950090.ece?utm_source=RSS_Feed&utm_medium=RSS&utm_campaign=RSS_Syndication","Tue, 27 Dec 2016 19:22:05 +0530","markets saw a big pullback rally on tuesday with the sensex logging its biggest single day gain of over 406 points in nearly three weeks and gold rebounding from an 11 month low but the rupee struc"
"HIN635","fcra licenses of 20 000 ngos cancelled since 2014","http://www.thehindu.com/news/national/FCRA-licenses-of-20000-NGOs-cancelled-since-2014/article16950063.ece?utm_source=RSS_Feed&utm_medium=RSS&utm_campaign=RSS_Syndication","Wed, 28 Dec 2016 02:51:59 +0530","since the nda government came to power in may 2014 the foreign contribution regulation act fcra licenses of at least 20 000 ngos were cancelled by the home ministry a senior ministry official said"
"HIN636","residents stage protest on railway tracks","http://www.thehindu.com/news/national/tamil-nadu/Residents-stage-protest-on-railway-tracks/article16950062.ece?utm_source=RSS_Feed&utm_medium=RSS&utm_campaign=RSS_Syndication","Tue, 27 Dec 2016 18:53:52 +0530","demolish wall blocking the shortest path for them to reach dindigul city"
"HIN637","nri alumnus makes gesture for a cause","http://www.thehindu.com/news/national/andhra-pradesh/NRI-alumnus-makes-gesture-for-a-cause/article16950054.ece?utm_source=RSS_Feed&utm_medium=RSS&utm_campaign=RSS_Syndication","Tue, 27 Dec 2016 18:51:07 +0530","kurnool a cardiologist settled at atlanta in the u s sreeni gangasani an alumnus of 1985 batch of the kurnool medical college kmc on tuesday donated a dozen stents each costing about rs 40 00"
"HIN638","chennai city will surprise the big guns this time says ravanan","http://www.thehindu.com/sport/football/Chennai-City-will-surprise-the-big-guns-this-time-says-Ravanan/article16950034.ece?utm_source=RSS_Feed&utm_medium=RSS&utm_campaign=RSS_Syndication","Wed, 28 Dec 2016 01:39:39 +0530","new delhi with his zlatan ibrahimovic esque hairstyle and a bright yellow jersey it seems to be the favourite colour of all chennai sports teams dharmaraj ravanan was the first to arrive on the s"
"HIN639","pil in delhi hc on applicability of constitutional amendments to j k","http://www.thehindu.com/news/national/other-states/PIL-in-Delhi-HC-on-applicability-of-Constitutional-amendments-to-JK/article16950026.ece?utm_source=RSS_Feed&utm_medium=RSS&utm_campaign=RSS_Syndication","Tue, 27 Dec 2016 18:38:18 +0530","the non applicability of any constitution amendment in jammu and kashmir without a presidential order under article 370 of the constitution has been challenged in the delhi high court which has dec"
"HIN640","nsf temporarily suspends manipur blockade","http://www.thehindu.com/news/national/other-states/NSF-temporarily-suspends-Manipur-blockade/article16949988.ece?utm_source=RSS_Feed&utm_medium=RSS&utm_campaign=RSS_Syndication","Tue, 27 Dec 2016 18:21:35 +0530","the naga students federation had imposed total blockade on all manipur bound vehicles and passengers in all naga inhabited areas from december 20"
"HIN641","rs 1 55 cr worth jewels missing from paccs hunt on for secretary","http://www.thehindu.com/news/national/tamil-nadu/Rs.-1.55-cr-worth-jewels-%E2%80%98missing%E2%80%99-from-PACCS-hunt-on-for-secretary/article16949973.ece?utm_source=RSS_Feed&utm_medium=RSS&utm_campaign=RSS_Syndication","Tue, 27 Dec 2016 18:19:53 +0530","ramanathapuram in a shocking incident 6 198 kg of gold jewels pledged by farmers to get loans from primary agricultural cooperative credit society paccs at a punavayal under kadaladi police limi"
"HIN642","trump un just a club for people to have a good time","http://www.thehindu.com/news/international/Trump-UN-just-a-club-for-people-to-%E2%80%98have-a-good-time%E2%80%99/article16949971.ece?utm_source=RSS_Feed&utm_medium=RSS&utm_campaign=RSS_Syndication","Tue, 27 Dec 2016 18:22:22 +0530","on friday trump warned as to the u n things will be different after jan 20th referring to the day he takes office"
"HIN643","high time to think about reservation in private sector says siddaramaiah","http://www.thehindu.com/news/cities/bangalore/High-time-to-think-about-reservation-in-private-sector-says-Siddaramaiah/article16949963.ece?utm_source=RSS_Feed&utm_medium=RSS&utm_campaign=RSS_Syndication","Tue, 27 Dec 2016 18:13:50 +0530","at a time when the karnataka government is pushing for reservation for local people in blue collar jobs in the private sector chief minister siddaramaiah batted for reservation in the private sector"
"HIN644","inequality yawning gap that remain to be bridged says hamid ansari","http://www.thehindu.com/news/cities/bangalore/Inequality-yawning-gap-that-remain-to-be-bridged-says-Hamid-Ansari/article16949961.ece?utm_source=RSS_Feed&utm_medium=RSS&utm_campaign=RSS_Syndication","Tue, 27 Dec 2016 18:10:22 +0530","where does india stand on the ladder of equity after 70 years of legislating welfare laws and measures to deliver social justice a fragmented we divided by yawning gaps that remain to be bridge"
"HIN645","m wallet retail spends may see 4 fold jump in near term study","http://www.thehindu.com/business/Economy/M-wallet-retail-spends-may-see-4-fold-jump-in-near-term-Study/article16949927.ece?utm_source=RSS_Feed&utm_medium=RSS&utm_campaign=RSS_Syndication","Tue, 27 Dec 2016 17:46:13 +0530","m wallet transactions in india are likely to grow at a compounded annual growth rate cagr of over 160 per cent to 260 billion by fy22 rising from just over half a billion in fy16 according to a s"
"HIN646","tata sons serves legal notice on cyrus mistry","http://www.thehindu.com/business/Industry/Tata-Sons-serves-legal-notice-on-Cyrus-Mistry/article16949920.ece1?utm_source=RSS_Feed&utm_medium=RSS&utm_campaign=RSS_Syndication","Tue, 27 Dec 2016 18:35:27 +0530","your actions and omissions have resulted in criminal breach of trust it said"
"HIN647","how the stock markets fared in 2016","http://www.thehindu.com/business/markets/How-the-stock-markets-fared-in-2016/article16949885.ece?utm_source=RSS_Feed&utm_medium=RSS&utm_campaign=RSS_Syndication","Tue, 27 Dec 2016 18:40:09 +0530","it would be an understatement to say that the bears had the upper hand for most parts of 2016 heavy domestic turbulence and extraordinary reactions to overseas news kept themarkets grounded whenever"
"HIN648","another season of i league rolled out","http://www.thehindu.com/sport/football/Another-season-of-I-League-rolled-out/article16949905.ece?utm_source=RSS_Feed&utm_medium=RSS&utm_campaign=RSS_Syndication","Tue, 27 Dec 2016 17:37:59 +0530","even as the tussle for supremacy and existence continues between the glamorous indian super league isl and the much maligned i league in the country the all india football federation launched the 1"
"HIN649","bjp says rama mohana rao must fight case in court","http://www.thehindu.com/news/national/BJP-says-Rama-Mohana-Rao-must-fight-case-in-court/article16949870.ece?utm_source=RSS_Feed&utm_medium=RSS&utm_campaign=RSS_Syndication","Tue, 27 Dec 2016 17:57:55 +0530","minister of state for finance arjun ram meghwal decries mr rao s statements saying everyone is equal before the law"
"HIN650","china calls for strategic balance in south asia after agni v test firing","http://www.thehindu.com/news/international/China-calls-for-strategic-balance-in-South-Asia-after-Agni-V-test-firing/article16949860.ece?utm_source=RSS_Feed&utm_medium=RSS&utm_campaign=RSS_Syndication","Tue, 27 Dec 2016 17:47:38 +0530","without referring to pakistan china on tuesday advocated preserving the strategic balance and stability in south asia after india successfully test fired agni v ballistic missile china always mai"
"HIN651","samit gohel carries the bat with 359","http://www.thehindu.com/sport/cricket/Samit-Gohel-carries-the-bat-with-359/article16949839.ece?utm_source=RSS_Feed&utm_medium=RSS&utm_campaign=RSS_Syndication","Wed, 28 Dec 2016 01:52:29 +0530","opener samit gohel carried the bat with 359 the highest in first class cricket for gujarat as odisha faded out of the ranji trophy quarterfinals at the sawai man singh stadium here on tuesday havin"
"HIN652","hyderabads pace trios season of plenty","http://www.thehindu.com/sport/cricket/Hyderabad%E2%80%99s-pace-trio%E2%80%99s-season-of-plenty/article16949831.ece?utm_source=RSS_Feed&utm_medium=RSS&utm_campaign=RSS_Syndication","Tue, 27 Dec 2016 17:13:39 +0530","if i have to pick an individual contribution it will undoubtedly be our three pacers they have been the most consistent amongst all teams right through the season s badrinath the hyderabad ca"
"HIN653","no other state has any right over punjabs waters badal","http://www.thehindu.com/news/national/other-states/No-other-state-has-any-right-over-Punjab%E2%80%99s-waters-Badal/article16949822.ece?utm_source=RSS_Feed&utm_medium=RSS&utm_campaign=RSS_Syndication","Tue, 27 Dec 2016 17:19:29 +0530","reiterating that as per the universally accepted riparian principle punjab was the only rightful owner of its river waters chief minister parkash singh badal on tuesday said no other state had an"
"HIN654","seven suspected cases of monkey fever in tirthahalli","http://www.thehindu.com/news/national/karnataka/Seven-suspected-cases-of-monkey-fever-in-Tirthahalli/article16949815.ece1?utm_source=RSS_Feed&utm_medium=RSS&utm_campaign=RSS_Syndication","Tue, 27 Dec 2016 21:20:12 +0530","seven suspected cases of kyasanur forest disease kfd better known as monkey fever have been reported from kudumallige gram panchayat limits in tirthahalli taluk the cases were reported between d"
"HIN655","will pm quit if cash flow doesnt ease mamata","http://www.thehindu.com/news/national/Will-PM-quit-if-cash-flow-doesn%E2%80%99t-ease-Mamata/article16949814.ece?utm_source=RSS_Feed&utm_medium=RSS&utm_campaign=RSS_Syndication","Wed, 28 Dec 2016 02:20:47 +0530","modi must take responsibility for demonetisation jolt says rahul"
"HIN656","ratnasiri wickremanayake veteran sri lankan politician passes away","http://www.thehindu.com/news/international/article16949799.ece?utm_source=RSS_Feed&utm_medium=RSS&utm_campaign=RSS_Syndication","Tue, 27 Dec 2016 18:52:30 +0530","the 83 year old leader served twice as prime minister first from 2000 to 2001 and then from 2005 to 2010"
"HIN657","bhovi community oppose sadashiva commission recommendations","http://www.thehindu.com/news/national/karnataka/Bhovi-community-oppose-Sadashiva-Commission-recommendations/article16949795.ece?utm_source=RSS_Feed&utm_medium=RSS&utm_campaign=RSS_Syndication","Tue, 27 Dec 2016 16:54:54 +0530","the akhil karnataka bhovi waddar yuva vedike has opposed the implementation of the justice a j sadashiva inquiry commission recommendations on providing internal reservation within the scheduled c"
"HIN658","maharashtra cabinet decides on rohit deo as advocate general","http://www.thehindu.com/news/cities/mumbai/Maharashtra-Cabinet-decides-on-Rohit-Deo-as-Advocate-General/article16949785.ece?utm_source=RSS_Feed&utm_medium=RSS&utm_campaign=RSS_Syndication","Tue, 27 Dec 2016 16:43:51 +0530","the maharashtra cabinet on tuesday made a decision to appoint associate advocate general ag rohit deo as permanent advocate general of the bombay high court sources at mantralaya have confirmed the"
"HIN659","going electric made easy","http://www.thehindu.com/sci-tech/health/Going-electric-made-easy/article16949783.ece?utm_source=RSS_Feed&utm_medium=RSS&utm_campaign=RSS_Syndication","Tue, 27 Dec 2016 16:36:25 +0530","the eride electric bike built in collaboration with fueladream a crowdfunding platform aims at making the daily commute easier"
"HIN660","throwing light on 2016 in social media","http://www.thehindu.com/sci-tech/technology/gadgets/Throwing-light-on-2016-in-social-media/article16949778.ece?utm_source=RSS_Feed&utm_medium=RSS&utm_campaign=RSS_Syndication","Tue, 27 Dec 2016 16:33:52 +0530","social media influencers tell nikhil varma how 2016 unfolded on the many platforms that drive the internet"
"HIN661","wheres the party tonight","http://www.thehindu.com/sci-tech/Where%E2%80%99s-the-party-tonight/article16949774.ece?utm_source=RSS_Feed&utm_medium=RSS&utm_campaign=RSS_Syndication","Tue, 27 Dec 2016 16:31:14 +0530","its time to ring in the new year and what better way to do so than a great party it could either be one of those parties with great music and unlimited drinks at a hotel replete with a dj and dance"
"HIN662","us tops weapons sales globally for 2015 congressional report","http://www.thehindu.com/news/international/US-tops-weapons-sales-globally-for-2015-Congressional-report/article16949771.ece?utm_source=RSS_Feed&utm_medium=RSS&utm_campaign=RSS_Syndication","Tue, 27 Dec 2016 17:29:11 +0530","the u s ranked first in global weapons sales in 2015 selling around 40 billion worth armaments or half of all agreements in the worldwide arms bazaar and more than double of nearest rival france"
"HIN663","cakes bakes and the best of 2016","http://www.thehindu.com/life-and-style/food/Cakes-bakes-and-the-best-of-2016/article16949694.ece?utm_source=RSS_Feed&utm_medium=RSS&utm_campaign=RSS_Syndication","Tue, 27 Dec 2016 16:07:04 +0530","k p balakumar puts together a list of six home bakers who have risen to popularity this past year with their decadent confections"
"HIN664","168 students awarded degrees at nimhans convocation","http://www.thehindu.com/news/cities/bangalore/168-students-awarded-degrees-at-NIMHANS-convocation/article16949677.ece?utm_source=RSS_Feed&utm_medium=RSS&utm_campaign=RSS_Syndication","Tue, 27 Dec 2016 17:20:00 +0530","at the 21st convocation of national institute of mental health and neurosciences held on tuesday 168 students were awarded degrees of these 15 were pdf students 28 phd 28 super speciality and 6"
"HIN665","best of television in 2016","http://www.thehindu.com/entertainment/Best-of-television-in-2016/article16949630.ece?utm_source=RSS_Feed&utm_medium=RSS&utm_campaign=RSS_Syndication","Tue, 27 Dec 2016 16:42:56 +0530","here is a list of several new shows that we at the hindu couldnt quit binge watching"
"HIN666","its time for sunburn","http://www.thehindu.com/news/cities/chennai/It%E2%80%99s-time-for-Sunburn/article16949594.ece?utm_source=RSS_Feed&utm_medium=RSS&utm_campaign=RSS_Syndication","Tue, 27 Dec 2016 15:55:26 +0530","the edm festival has moved from goa to pune this year"
"HIN667","life begins at 40","http://www.thehindu.com/news/cities/chennai/%E2%80%98Life-begins-at-40%E2%80%99/article16949515.ece?utm_source=RSS_Feed&utm_medium=RSS&utm_campaign=RSS_Syndication","Tue, 27 Dec 2016 15:52:33 +0530","triumphant after fighting chronic kidney disease lourd vijay talks about living life to the fullest dancing salsa in cuba and chilling at the ziro festival in arunachal pradesh"
"HIN668","israel plans more settlements abbas looks to paris summit","http://www.thehindu.com/news/international/Israel-plans-more-settlements-Abbas-looks-to-Paris-summit/article16949502.ece?utm_source=RSS_Feed&utm_medium=RSS&utm_campaign=RSS_Syndication","Tue, 27 Dec 2016 17:31:38 +0530","mr netanyahu has repeatedly called on mr abbas to meet for direct talks without preconditions mr abbas has refused unless israel ends settlement construction first"
"HIN669","best of malayalam movies in 2016","http://www.thehindu.com/entertainment/movies/Best-of-Malayalam-movies-in-2016/article16941703.ece?utm_source=RSS_Feed&utm_medium=RSS&utm_campaign=RSS_Syndication","Tue, 27 Dec 2016 15:46:45 +0530","rasmi binoy gives her selection of top 5 malayalam movies released this year"
"HIN670","the hindu cinema polls 2016","http://www.thehindu.com/entertainment/movies/The-Hindu-Cinema-Polls-2016/article16949351.ece1?utm_source=RSS_Feed&utm_medium=RSS&utm_campaign=RSS_Syndication","Tue, 27 Dec 2016 15:39:49 +0530","a look at the hindu cinemas polls that fared the best in 2016"
"HIN671","the anglo indian way of life","http://www.thehindu.com/society/history-and-culture/The-Anglo-Indian-way-of-life/article16949484.ece?utm_source=RSS_Feed&utm_medium=RSS&utm_campaign=RSS_Syndication","Tue, 27 Dec 2016 15:25:29 +0530","a chat with keith st clair butler author of the secret vindaloo"
"HIN672","rayanna brigade will not play political or electoral role says eshwarappa","http://www.thehindu.com/news/national/karnataka/Rayanna-Brigade-will-not-play-political-or-electoral-role-says-Eshwarappa/article16949431.ece?utm_source=RSS_Feed&utm_medium=RSS&utm_campaign=RSS_Syndication","Tue, 27 Dec 2016 15:18:54 +0530","the sangolli rayanna brigade srb has done a dramatic volte face on it playing an instrumental role in the next elections to bring the bharatiya janata party back to power under the leadership of pa"
"HIN673","space time and the startup","http://www.thehindu.com/society/Space-time-and-the-startup/article16949415.ece?utm_source=RSS_Feed&utm_medium=RSS&utm_campaign=RSS_Syndication","Tue, 27 Dec 2016 19:01:32 +0530","from enabling rural populace and a mission to the moon to generating content and building a durable commute choice four indian ventures have made a mark globally this year team metroplus narrates their success stories"
