"id","title","link","pubDate","desc"
"HIN1","due date extended for intermediate exam fee","http://www.thehindu.com/news/cities/Hyderabad/Due-date-extended-for-Intermediate-exam-fee/article16960576.ece?utm_source=RSS_Feed&utm_medium=RSS&utm_campaign=RSS_Syndication","Fri, 30 Dec 2016 00:11:20 +0530","hyderabad the due dates for payment of ssc examination fee regular private once failed have been extended for remittance of examination fee under tatkal scheme last date for remittance to the head"
"HIN2","acb raids offices residences of three govt officials in bengaluru","http://www.thehindu.com/news/national/karnataka/ACB-raids-offices-residences-of-three-govt.-officials-in-Bengaluru/article16960573.ece?utm_source=RSS_Feed&utm_medium=RSS&utm_campaign=RSS_Syndication","Fri, 30 Dec 2016 00:08:56 +0530","the anti corruption bureau acb bengaluru conducted raids on the houses of three government officials including a deputy director of land records bengaluru rural on thursday according to acb of"
"HIN3","atm coverage poor in karnataka","http://www.thehindu.com/news/national/karnataka/ATM-coverage-poor-in-Karnataka/article16960569.ece?utm_source=RSS_Feed&utm_medium=RSS&utm_campaign=RSS_Syndication","Fri, 30 Dec 2016 00:08:49 +0530","20 districts rank below national average of 17 atms per 1 lakh population"
"HIN4","talking to children about untouchability","http://www.thehindu.com/opinion/op-ed/Talking-to-children-about-untouchability/article16960326.ece?utm_source=RSS_Feed&utm_medium=RSS&utm_campaign=RSS_Syndication","Thu, 29 Dec 2016 23:01:11 +0530","rather than deny its existence it is time for parents teachers and even the government to start talking to children about ending such practices today"
"HIN5","notes to remember","http://www.thehindu.com/opinion/op-ed/Notes-to-remember/article16960300.ece?utm_source=RSS_Feed&utm_medium=RSS&utm_campaign=RSS_Syndication","Thu, 29 Dec 2016 22:57:02 +0530","if even the united states has not yet given up on cash should india"
"HIN6","demonetisation presents an opportunity","http://www.thehindu.com/opinion/columns/Demonetisation-presents-an-opportunity/article16960245.ece?utm_source=RSS_Feed&utm_medium=RSS&utm_campaign=RSS_Syndication","Thu, 29 Dec 2016 22:47:49 +0530","a flailing congress party after suffering several electoral defeats in many state elections since 2014 has narrowed its focus on to pro poor and agrarian issues as a way to shore up popular support"
"HIN7","cartoonscape december 30 2016","http://www.thehindu.com/opinion/cartoon/article16960235.ece?utm_source=RSS_Feed&utm_medium=RSS&utm_campaign=RSS_Syndication","Thu, 29 Dec 2016 22:43:32 +0530","30thcartoonscape"
"HIN8","goodbye barack","http://www.thehindu.com/opinion/lead/Goodbye-Barack/article16960230.ece?utm_source=RSS_Feed&utm_medium=RSS&utm_campaign=RSS_Syndication","Thu, 29 Dec 2016 22:40:13 +0530","the election of its first black president was the beginning of the change america needed and which the world applauded it is also the change america has reversed and which the world is regretting"
"HIN9","peace on track in colombia","http://www.thehindu.com/opinion/editorial/Peace-on-track-in-Colombia/article16960217.ece?utm_source=RSS_Feed&utm_medium=RSS&utm_campaign=RSS_Syndication","Thu, 29 Dec 2016 22:37:05 +0530","colombias government now knows only too well that there is many a slip between the cup and the lip in october a referendum to ratify a painstakingly negotiated peace deal it had signed with the lon"
"HIN10","sasikala rising","http://www.thehindu.com/opinion/editorial/Sasikala-rising/article16960211.ece?utm_source=RSS_Feed&utm_medium=RSS&utm_campaign=RSS_Syndication","Thu, 29 Dec 2016 22:35:43 +0530","that v k sasikala was nominated general secretary of the aiadmk by its general council is no surprise her elevation from party worker to party head has followed days of demands and entreaties from s"
"HIN11","cbcs holds key for future generations","http://www.thehindu.com/news/national/telangana/%E2%80%98CBCS-holds-key-for-future-generations%E2%80%99/article16960535.ece?utm_source=RSS_Feed&utm_medium=RSS&utm_campaign=RSS_Syndication","Fri, 30 Dec 2016 00:01:54 +0530","b rajashekhar dean of management sciences university of hyderabad said the choice based credit system cbcs holds the key for future generations of the country speaking at the two day national s"
"HIN12","the achievers club","http://www.thehindu.com/news/cities/Hyderabad/The-achievers%E2%80%99-club/article16960526.ece?utm_source=RSS_Feed&utm_medium=RSS&utm_campaign=RSS_Syndication","Fri, 30 Dec 2016 00:01:32 +0530","a look back on some of the major achievements of sportspersons from the state"
"HIN13","paigah tombs complex to be added to swadesh darshan circuit","http://www.thehindu.com/news/cities/Hyderabad/Paigah-tombs-complex-to-be-added-to-Swadesh-Darshan-circuit/article16960518.ece?utm_source=RSS_Feed&utm_medium=RSS&utm_campaign=RSS_Syndication","Thu, 29 Dec 2016 23:59:54 +0530","the paigah tombs complex at phisalbanda on the fringes of hyderabad is set to be added to the swadesh darshan circuit along with qutb shahi tombs raymonds tomb and hayat baqshi begum masjid the"
"HIN14","kuvempu tried to eradicate blind beliefs through his works minister","http://www.thehindu.com/news/national/karnataka/Kuvempu-tried-to-eradicate-blind-beliefs-through-his-works-Minister/article16960490.ece?utm_source=RSS_Feed&utm_medium=RSS&utm_campaign=RSS_Syndication","Thu, 29 Dec 2016 23:53:29 +0530","vishwamanava day marks jnanpith award winners 112 birth anniversary"
"HIN15","versatility is key","http://www.thehindu.com/entertainment/music/Versatility-is-key/article16960487.ece?utm_source=RSS_Feed&utm_medium=RSS&utm_campaign=RSS_Syndication","Thu, 29 Dec 2016 23:53:21 +0530","it would be unusual to find a person who has not danced to the beats of neha kakkars songs with mesmerising music and thumping beats her funky songs like kar gayi chull and kala chashma inspir"
"HIN16","akhilesh declares parallel list of candidates","http://www.thehindu.com/news/national/other-states/Akhilesh-declares-parallel-list-of-candidates/article16960480.ece?utm_source=RSS_Feed&utm_medium=RSS&utm_campaign=RSS_Syndication","Thu, 29 Dec 2016 23:54:46 +0530","in an open rebellion that could split the ruling sp uttar pradesh chief minister akhilesh yadav tonight declared his own candidates for 235 seats against the official list announced by his father an"
"HIN17","fervour marks ellu amavasya in kalaburagi district","http://www.thehindu.com/news/national/karnataka/Fervour-marks-Ellu-Amavasya-in-Kalaburagi-district/article16960477.ece?utm_source=RSS_Feed&utm_medium=RSS&utm_campaign=RSS_Syndication","Thu, 29 Dec 2016 23:52:23 +0530","ellu amavasya a harvest festival was celebrated with fervour across kalaburagi district on thursday cutting across caste and communal lines the entire farming community paid their obeisances to m"
"HIN18","shankar pratishtan awards scholarships announced","http://www.thehindu.com/news/national/karnataka/Shankar-Pratishtan-awardsscholarships-announced/article16960472.ece?utm_source=RSS_Feed&utm_medium=RSS&utm_campaign=RSS_Syndication","Thu, 29 Dec 2016 23:51:34 +0530","dr p s shankar pratishtan kalaburagi a charitable trust working in the field of health and medical education has announced two awards for medical professionals and scholarships for five medical"
"HIN19","revised sarojini mahishi panelrecommendationsin a fortnight","http://www.thehindu.com/news/national/karnataka/%E2%80%98Revised-Sarojini-Mahishi-panelrecommendationsin-a-fortnight%E2%80%99/article16960467.ece?utm_source=RSS_Feed&utm_medium=RSS&utm_campaign=RSS_Syndication","Thu, 29 Dec 2016 23:50:42 +0530","chief minister had constituted 21 member committee headed by kda chairman"
"HIN20","lets rewind","http://www.thehindu.com/entertainment/movies/Let%E2%80%99s-rewind/article16960462.ece?utm_source=RSS_Feed&utm_medium=RSS&utm_campaign=RSS_Syndication","Thu, 29 Dec 2016 23:47:34 +0530","if you are seeking to welcome the new year from the warmth of quilt with a mug of coffee we have brewed an eclectic mix of films from the 70s that have been picked from the ones featured in the colum"
"HIN21","the wizard of strings","http://www.thehindu.com/entertainment/music/The-wizard-of-strings/article16960435.ece?utm_source=RSS_Feed&utm_medium=RSS&utm_campaign=RSS_Syndication","Thu, 29 Dec 2016 23:33:11 +0530","remembering ustad hafiz ali khan the sarod legend whose thirst for purity in music transported the audience to a spiritual experience"
"HIN22","the legend lives on","http://www.thehindu.com/entertainment/theatre/The-legend-lives-on/article16960427.ece?utm_source=RSS_Feed&utm_medium=RSS&utm_campaign=RSS_Syndication","Thu, 29 Dec 2016 23:29:43 +0530","subtle lighting and powerful performances made keerti kirpal interpretation of pooran enjoyable"
"HIN23","collector flags off 2k run","http://www.thehindu.com/news/national/andhra-pradesh/Collector-flags-off-2k-run/article16960420.ece?utm_source=RSS_Feed&utm_medium=RSS&utm_campaign=RSS_Syndication","Thu, 29 Dec 2016 23:29:05 +0530","kurnool district collector ch vijayamohan flagged off a 2k run by girl students from the birla gate to the kurnool collectorate on women safety and security as a prelude to the jayanthi of the co"
"HIN24","triple talaq over phone is valid says deoband fatwa","http://www.thehindu.com/news/national/Triple-talaq-over-phone-is-valid-says-Deoband-fatwa/article16960413.ece?utm_source=RSS_Feed&utm_medium=RSS&utm_campaign=RSS_Syndication","Thu, 29 Dec 2016 23:27:36 +0530","amid an ongoing debate islamic seminaries in deoband have issued a fatwa endorsing triple talaq divorce by uttering the word talaq thrice in quick succession over the phone responding to a ques"
"HIN25","two soldiers injured in militant firing in kashmir","http://www.thehindu.com/news/national/Two-soldiers-injured-in-militant-firing-in-Kashmir/article16960412.ece?utm_source=RSS_Feed&utm_medium=RSS&utm_campaign=RSS_Syndication","Thu, 29 Dec 2016 23:27:01 +0530","two soldiers were injured in firing by militants in kashmir on thursday a team of the army and the police came under heavy fire from militants in shahgund hajin bandipora on thursday morning a pol"
"HIN26","hope becomes the biggest casualty in restive jammu and kashmir","http://www.thehindu.com/news/national/Hope-becomes-the-biggest-casualty-in-restive-Jammu-and-Kashmir/article16960407.ece?utm_source=RSS_Feed&utm_medium=RSS&utm_campaign=RSS_Syndication","Thu, 29 Dec 2016 23:26:18 +0530","hope became the biggest casualty in jammu and kashmir in 2016 as the ruling alliance of the peoples democratic party pdp and the bharatiya janata party bjp struggled to give one reason to smile"
"HIN27","manmohan singh to release congress poll manifesto for punjab","http://www.thehindu.com/news/national/Manmohan-Singh-to-release-Congress-poll-manifesto-for-Punjab/article16960404.ece?utm_source=RSS_Feed&utm_medium=RSS&utm_campaign=RSS_Syndication","Thu, 29 Dec 2016 23:25:34 +0530","former prime minister manmohan singh will soon release the congresss election manifesto for the punjab assembly elections the date is yet to be finalised dr singh congress in charge of punjab aff"
"HIN28","pakistan ready for resumption of talks","http://www.thehindu.com/news/national/Pakistan-ready-for-resumption-of-talks/article16960402.ece?utm_source=RSS_Feed&utm_medium=RSS&utm_campaign=RSS_Syndication","Thu, 29 Dec 2016 23:24:57 +0530","we remain committed to amicably resolving the kashmir dispute and all outstanding issues with india says official"
"HIN29","ntr kala parishad floats kala nidhi","http://www.thehindu.com/news/national/andhra-pradesh/NTR-Kala-Parishad-floats-%E2%80%98Kala-Nidhi%E2%80%99/article16960398.ece?utm_source=RSS_Feed&utm_medium=RSS&utm_campaign=RSS_Syndication","Thu, 29 Dec 2016 23:24:24 +0530","aim is to resurrect dying indigenous art forms says parishad founder"
"HIN30","modi may address nation on new years eve","http://www.thehindu.com/news/national/Modi-may-address-nation-on-New-Year%E2%80%99s-Eve/article16960395.ece?utm_source=RSS_Feed&utm_medium=RSS&utm_campaign=RSS_Syndication","Thu, 29 Dec 2016 23:24:18 +0530","prime minister narendra modi is likely to address the nation on saturday evening before the dawn of the new year a day after the 50 day deadline set by the government for people to deposit scrapped"
"HIN31","chief of the naval staff admiral sunil lanba to chair committee of chiefs","http://www.thehindu.com/news/national/Chief-of-the-Naval-Staff-Admiral-Sunil-Lanba-to-chair-committee-of-Chiefs/article16960390.ece?utm_source=RSS_Feed&utm_medium=RSS&utm_campaign=RSS_Syndication","Thu, 29 Dec 2016 23:23:19 +0530","presently the post is held on rotation basis by the seniormost of the three service chiefs"
"HIN32","an ode to cityscapes","http://www.thehindu.com/entertainment/art/An-ode-to-cityscapes/article16960369.ece?utm_source=RSS_Feed&utm_medium=RSS&utm_campaign=RSS_Syndication","Thu, 29 Dec 2016 23:10:26 +0530","the ongoing exhibition of ram kumars works is a paean to the consonance of line where the thread between memory and image gets blurred writes uma nair"
"HIN33","custodial torture police panel chief slams delinquent officers","http://www.thehindu.com/news/cities/Kochi/Custodial-torture-police-panel-chief-slams-delinquent-officers/article16960358.ece?utm_source=RSS_Feed&utm_medium=RSS&utm_campaign=RSS_Syndication","Thu, 29 Dec 2016 23:08:30 +0530","transferring officers is no deterrent says narayana kurup"
"HIN34","cavemen may have used toothpicks even before making meals with fire","http://www.thehindu.com/sci-tech/science/Cavemen-may-have-used-toothpicks-even-before-making-meals-with-fire/article16960354.ece?utm_source=RSS_Feed&utm_medium=RSS&utm_campaign=RSS_Syndication","Thu, 29 Dec 2016 23:07:17 +0530","researchers found wood fibres in a 1 2 million year old tooth found in europe"
"HIN35","is military leader killed in syria air strike pentagon","http://www.thehindu.com/news/international/IS-military-leader-killed-in-Syria-air-strike-Pentagon/article16960351.ece?utm_source=RSS_Feed&utm_medium=RSS&utm_campaign=RSS_Syndication","Thu, 29 Dec 2016 23:03:41 +0530","a key military commander for the islamic state group in syria has been killed in an air strike carried out by the us led coalition the pentagon said thursday abu jandal al kuwaiti died monday near t"
"HIN36","playing a populist tune","http://www.thehindu.com/entertainment/music/Playing-a-populist-tune/article16960349.ece?utm_source=RSS_Feed&utm_medium=RSS&utm_campaign=RSS_Syndication","Thu, 29 Dec 2016 23:03:18 +0530","the tendency to compromise content for speed and virtuosity marked the music scene in 2016 notes manjari sinha"
"HIN37","for china a year of purge and unity","http://www.thehindu.com/news/international/For-China-a-year-of-purge-and-unity/article16960318.ece?utm_source=RSS_Feed&utm_medium=RSS&utm_campaign=RSS_Syndication","Thu, 29 Dec 2016 23:01:00 +0530","unanswered questions about chinas rise peaceful or otherwise continued to grab headlines throughout 2016 after decades of cooperation it was clear that the relations between the worlds larges"
"HIN38","from panchalis perspective","http://www.thehindu.com/entertainment/dance/From-Panchali%E2%80%99s-perspective.../article16960312.ece?utm_source=RSS_Feed&utm_medium=RSS&utm_campaign=RSS_Syndication","Thu, 29 Dec 2016 22:58:27 +0530","the multi layered character of draupadi was perceptively explored in from fire to fire"
"HIN39","an identity crisis for the u k","http://www.thehindu.com/news/international/An-identity-crisis-for-the-U.K./article16960306.ece?utm_source=RSS_Feed&utm_medium=RSS&utm_campaign=RSS_Syndication","Thu, 29 Dec 2016 22:57:54 +0530","in times to come 2016 will be looked at as a watershed year in british history in the june 23 referendum on brexit 52 per cent of voters chose to leave the eu the u k s decision to leave the bl"
"HIN40","farmer killed as operation to drive back tigress goes awry","http://www.thehindu.com/news/national/karnataka/Farmer-killed-as-operation-to-drive-back-tigress-goes-awry/article16960296.ece?utm_source=RSS_Feed&utm_medium=RSS&utm_campaign=RSS_Syndication","Thu, 29 Dec 2016 22:56:43 +0530","an operation to drive back a tigress and its two cubs that had strayed into a village went awry with a farmer being killed due to bullet wounds in h d kote on thursday the incident took place late"
"HIN41","kpsc postpones examination","http://www.thehindu.com/news/national/karnataka/KPSC-postpones-examination/article16960287.ece?utm_source=RSS_Feed&utm_medium=RSS&utm_campaign=RSS_Syndication","Thu, 29 Dec 2016 22:55:50 +0530","the karnataka public service commission kpsc has postponed the main examination scheduled to be held on january 7 8 10 and 11 for recruitment to 162 posts of assistant controllers group a and"
"HIN42","panel brainstorms on making question papers error free","http://www.thehindu.com/news/national/karnataka/Panel-brainstorms-on-making-question-papers-error-free/article16960280.ece?utm_source=RSS_Feed&utm_medium=RSS&utm_campaign=RSS_Syndication","Thu, 29 Dec 2016 22:55:11 +0530","suggests appointment of moderator who will carefully examine the paper"
"HIN43","creation and the wheel of time","http://www.thehindu.com/entertainment/dance/Creation-and-the-wheel-of-time/article16960275.ece?utm_source=RSS_Feed&utm_medium=RSS&utm_campaign=RSS_Syndication","Thu, 29 Dec 2016 22:54:43 +0530","as 2016 turns to 2017 anjana rajan looks at some of the changing perspectives of classical dancers"
"HIN44","i want to topple the govt in 2017 says rajapaksa","http://www.thehindu.com/news/international/I-want-to-topple-the-govt.-in-2017-says-Rajapaksa/article16960262.ece?utm_source=RSS_Feed&utm_medium=RSS&utm_campaign=RSS_Syndication","Thu, 29 Dec 2016 22:48:35 +0530","two years after he was unseated former sri lankan president mahinda rajapaksa for the first time explicitly stated his intent to make a political comeback saying he wants to topple the current go"
"HIN45","4th yash chopra award for king khan","http://www.thehindu.com/news/cities/Hyderabad/4th-Yash-Chopra-award-for-%E2%80%98King-Khan%E2%80%99/article16960240.ece?utm_source=RSS_Feed&utm_medium=RSS&utm_campaign=RSS_Syndication","Thu, 29 Dec 2016 22:47:07 +0530","after lata mangeshkar amitabh bachchan and rekha its now the turn of actor shah rukh khan to receive the fourth yash chopra national memorial award instituted by the tsr foundation the jury of th"
"HIN46","congress tdp cpi m boycott assembly proceedings","http://www.thehindu.com/news/cities/Hyderabad/Congress-TDP-CPI-M-boycott-Assembly-proceedings/article16960218.ece?utm_source=RSS_Feed&utm_medium=RSS&utm_campaign=RSS_Syndication","Thu, 29 Dec 2016 22:37:46 +0530","protest against not getting ample opportunity to express their views on amendments to the la act"
"HIN47","la act for remedying injustice done to ts","http://www.thehindu.com/news/cities/Hyderabad/%E2%80%98LA-Act-for-remedying-injustice-done-to-TS%E2%80%99/article16960212.ece?utm_source=RSS_Feed&utm_medium=RSS&utm_campaign=RSS_Syndication","Thu, 29 Dec 2016 22:35:56 +0530","irrigation minister t harish rao asserted that the state government has proposed to introduce the right to fair compensation and transparency in land acquisition rehabilitation and resettlement te"
"HIN48","this year to last a second longer","http://www.thehindu.com/news/international/This-year-to-last-a-second-longer/article16960209.ece?utm_source=RSS_Feed&utm_medium=RSS&utm_campaign=RSS_Syndication","Thu, 29 Dec 2016 22:52:27 +0530","this year will last a second longer as a leap second will be added o the worlds clocks on new years eve by the timekeepers the extra second will be inserted at the us naval observatorys maste"
"HIN49","trying to get monkey off the back","http://www.thehindu.com/news/cities/Hyderabad/Trying-to-get-monkey-off-the-back/article16960204.ece?utm_source=RSS_Feed&utm_medium=RSS&utm_campaign=RSS_Syndication","Thu, 29 Dec 2016 22:34:43 +0530","discussion on monkey menace dominates the assembly session"
"HIN50","plaints against bsy eshwarappa dismissed","http://www.thehindu.com/news/national/karnataka/Plaints-against-BSY-Eshwarappa-dismissed/article16960203.ece?utm_source=RSS_Feed&utm_medium=RSS&utm_campaign=RSS_Syndication","Thu, 29 Dec 2016 22:33:58 +0530","the special lokayukta court here on thursday dismissed three private complaints lodged against bjp state president b s yeddyurappa and one against leader of the opposition in the legislative council"
"HIN51","on the road to making national highways safer","http://www.thehindu.com/news/cities/Hyderabad/On-the-road-to-making-national-highways-safer/article16960191.ece?utm_source=RSS_Feed&utm_medium=RSS&utm_campaign=RSS_Syndication","Thu, 29 Dec 2016 22:33:31 +0530","r b department begins an exercise to identify dark spots and accident prone areas on nhs in ts"
"HIN52","cashier ended life even before probe began","http://www.thehindu.com/news/national/karnataka/%E2%80%98Cashier-ended-life-even-before-probe-began%E2%80%99/article16960186.ece?utm_source=RSS_Feed&utm_medium=RSS&utm_campaign=RSS_Syndication","Thu, 29 Dec 2016 22:33:05 +0530","investigations have now revealed that raviraj the head cashier of the currency management branch state bank of mysore hanged himself even before a formal probe was launched against him for his all"
"HIN53","now wifi at railway stations of twin cities","http://www.thehindu.com/news/cities/Hyderabad/Now-WiFi-at-railway-stations-of-twin-cities/article16960172.ece?utm_source=RSS_Feed&utm_medium=RSS&utm_campaign=RSS_Syndication","Thu, 29 Dec 2016 22:31:37 +0530","railway minister suresh prabhu launches high speed wifi services offered by railtel corporation"
"HIN54","special dsc for urdu medium schools likely","http://www.thehindu.com/news/cities/Hyderabad/Special-DSC-for-Urdu-medium-schools-likely/article16960167.ece?utm_source=RSS_Feed&utm_medium=RSS&utm_campaign=RSS_Syndication","Thu, 29 Dec 2016 22:29:56 +0530","education minister kadiam srihari said that the government would consider conducting a special dsc for recruitment of teachers in urdu medium schools in the state responding to a query from mim membe"
"HIN55","opposition ruling party on the same page","http://www.thehindu.com/news/cities/Hyderabad/Opposition-ruling-party-on-the-same-page/article16960162.ece?utm_source=RSS_Feed&utm_medium=RSS&utm_campaign=RSS_Syndication","Thu, 29 Dec 2016 22:25:56 +0530","in a role reversal of sorts it was the opposition that took the lead in emphasising the need for launching a movement to strengthen government schools in the state raising the issue of neglect of go"
"HIN56","central bank autonomy back in focus","http://www.thehindu.com/business/Central-bank-autonomy-back-in-focus/article16960150.ece?utm_source=RSS_Feed&utm_medium=RSS&utm_campaign=RSS_Syndication","Thu, 29 Dec 2016 22:18:55 +0530","mumbai 2016 will be remembered as the year that saw bad loans at public sector banks scale new peaks as former reserve bank of india rbi governor raghuram rajans push to clean up lenders balance"
"HIN57","govt meets pmuy target of 1 5 crore lpg connection additions this financial year","http://www.thehindu.com/business/Govt-meets-PMUY-target-of-1.5-crore-LPG-connection-additions-this-financial-year/article16960147.ece?utm_source=RSS_Feed&utm_medium=RSS&utm_campaign=RSS_Syndication","Thu, 29 Dec 2016 22:18:17 +0530","new delhi the government on thursday said that it has met the 1 5 crore target for lpg connections to be added in this financial year under the pradhan mantri ujjwala yojana pmuy and so has increas"
"HIN58","financial data management body mooted","http://www.thehindu.com/business/Financial-data-management-body-mooted/article16960144.ece?utm_source=RSS_Feed&utm_medium=RSS&utm_campaign=RSS_Syndication","Thu, 29 Dec 2016 22:17:42 +0530","a committee set up under the department of economic affairs has recommended the creation of a statutory body that will standardise data from all financial sector regulators in a single database and w"
"HIN59","tata sons asks mistry to return all property","http://www.thehindu.com/business/Tata-Sons-asks-Mistry-to-return-all-%E2%80%98property%E2%80%99/article16960143.ece?utm_source=RSS_Feed&utm_medium=RSS&utm_campaign=RSS_Syndication","Thu, 29 Dec 2016 22:17:02 +0530","continuing its legal pressure tata sons through law firm shardul amarchand mangaldas has served a legal notice on former chairman cyrus mistry asking him to immediately return all confidential info"
"HIN60","banks likely to remain risk averse","http://www.thehindu.com/business/%E2%80%98Banks-likely-to-remain-risk-averse%E2%80%99/article16960136.ece?utm_source=RSS_Feed&utm_medium=RSS&utm_campaign=RSS_Syndication","Thu, 29 Dec 2016 22:15:04 +0530","lenders capital position may remain insufficient to support higher credit growth says rbi"
"HIN61","solaphur to host first global uniform and garment fair","http://www.thehindu.com/business/Solaphur-to-host-first-global-uniform-and-garment-fair/article16960133.ece?utm_source=RSS_Feed&utm_medium=RSS&utm_campaign=RSS_Syndication","Thu, 29 Dec 2016 22:11:08 +0530","over 6 000 retailers are expected to take part in indias first uniform and garment manufacturers exhibition to be held in solapur maharashtra for three days from january 5 to 7 the fair is organi"
"HIN62","ktdc also feels the pinch","http://www.thehindu.com/news/cities/Thiruvananthapuram/KTDC-also-feels-the-pinch/article16960129.ece?utm_source=RSS_Feed&utm_medium=RSS&utm_campaign=RSS_Syndication","Thu, 29 Dec 2016 22:10:54 +0530","thiruvananthapuram despite a five per cent increase in occupancy in the last three quarters the kerala tourism development corporation ktdc has been hit by drop in tourist arrivals due to a host of"
